author,category,content,country,description,publishedAt,source,title,url,urlToImage
caschy,technology,"Man kann vermutlich gar nicht so um die Ecke denken, wie es kommen kann – gerade in Bezug auf Technik. Vor einigen Tagen teilte ein US-Nutzer der Online-Community Reddit seine Geschichte mit:
Bei so… [+2526 chars]",deu,"Man kann vermutlich gar nicht so um die Ecke denken, wie es kommen kann - gerade in Bezug auf Technik. Vor einigen Tagen teilte ein ...",2021-12-09T06:57:00Z,Caschys Blog,Google Pixel: Android-Bug in Verbindung mit Microsoft Teams verhinderte einen Notruf - Caschys Blog,https://stadt-bremerhaven.de/google-pixel-android-bug-in-verbindung-mit-microsoft-teams-verhinderte-einen-notruf/,https://stadt-bremerhaven.de/wp-content/uploads/2019/08/Android-logo.jpg
"Jonas Mahlmann, Anna Kalinowsky",technology,"Im November 2021 machte Google Nägel mit Köpfen und begann, die Zwei-Faktor-Authentifizierung automatisch für 150 Millionen Google-Konten zu aktivieren. Das soll die Sicherheit der Nutzer verbessern.… [+11120 chars]",deu,Google hat kürzlich die Zwei-Faktor-Authentifizierung für 150 Millionen Nutzer eingeschaltet. Wir klären die wichtigsten Fragen rund um das Sicherheitssystem.,2021-12-09T06:30:00Z,heise online,Google erzwingt Zwei-Faktor-Authentifizierung für alle - das müssen Sie wissen - heise online,https://www.heise.de/ratgeber/Google-erzwingt-Zwei-Faktor-Authentifizierung-fuer-alle-das-muessen-Sie-wissen-6287087.html,https://heise.cloudimg.io/bound/1200x1200/q85.png-lossy-85.webp-lossy-85.foil1/_www-heise-de_/imgs/18/3/2/2/7/6/3/6/shutterstock_1857802108-9229143dfea9cc3b.jpg
DER SPIEGEL,technology,"Verbraucher in der EU werden weitere zehn Jahre vom Wegfall der Roaminggebühren profitieren. Unterhändler der EU-Staaten und des Europaparlaments einigten sich darauf, die populären Regeln über Ende … [+1271 chars]",deu,Telefonieren oder Internetsurfen konnte früher auf Reisen eine echte Kostenfalle sein. Das hatte die EU vor knapp fünf Jahren verboten. Die Regelung wird nun verlängert – und verbessert.,2021-12-09T06:27:01Z,Spiegel Online,Mobilfunk im Ausland: Roaminggebühren fallen für weitere zehn Jahre weg - DER SPIEGEL,https://www.spiegel.de/netzwelt/netzpolitik/eu-roaming-gebuehren-fallen-fuer-weitere-zehn-jahre-weg-a-7191c48f-a82b-4d10-8a80-f8fd14d5c91d,https://cdn.prod.www.spiegel.de/images/db209324-0001-0004-0000-000000738050_w1280_r1.77_fpx71.9_fpy49.97.jpg
Tobias Stadler,technology,"Lycamobile ist ein beliebter Mobilfunkanbieter. Insbesondere die Pre-Paid-Karten sind populär. Bereits im Mai musste das Unternehmen aber einen Insolvenzantrag stellen. Wie das ""Handelsblatt"" bericht… [+2205 chars]",deu,"70 Millionen Euro Steuerschulden haben einen beliebten Mobilfunkanbieter dazu gezwungen, Insolvenz anzumelden. Die Einzelheiten fassen wir in diesem Artikel für Sie zusammen.",2021-12-09T05:13:00Z,CHIP Online Deutschland,Beliebter Mobilfunkanbieter ist insolvent: Steuerschulden im Wert von 70 Millionen Euro - CHIP Online Deutschland,https://www.chip.de/news/Mobilfunkanbieter-wegen-Steuerschulden-in-Millionenhoehe-insolvent_183986296.html,https://www.chip.de/ii/1/2/6/5/5/7/6/5/7/6137702a2917a4f9.jpeg
"Simon Hage, Yasemin Yüksel",technology,"Mehr Perspektiven, mehr verstehen.
Freier Zugang zu allen Artikeln, Videos, Audioinhalten und Podcasts
<ul><li>
Alle Artikel auf SPIEGEL.de frei zugänglich
</li><li>
DER SPIEGEL als E-Paper und … [+726 chars]",deu,"Elon Musk baut Elektroautos und Raketen, mit denen er Menschen auf den Mars schicken will. Er ist einer der reichsten Männer der Welt und gibt zuweilen den Underdog. Wie tickt der vielleicht einflussreichste Unternehmer unserer Zeit?",2021-12-09T05:00:00Z,Spiegel Online,Radikal und visionär: Die Geschichte von Elon Musk - DER SPIEGEL,https://www.spiegel.de/wirtschaft/elon-musk-wie-tickt-der-unternehmer-podcast-a-80f5a484-4a5d-40a4-bff7-a6d08c0cee0b,https://cdn.prod.www.spiegel.de/images/e6355703-a0de-4c64-ae2d-cdbadf5f5cdb_w1280_r1.77_fpx50_fpy50.jpg
Michael Brächer,technology,"Mehr Perspektiven, mehr verstehen.
Freier Zugang zu allen Artikeln, Videos, Audioinhalten und Podcasts
<ul><li>
Alle Artikel auf SPIEGEL.de frei zugänglich
</li><li>
DER SPIEGEL als E-Paper und … [+735 chars]",deu,"Bitcoin-Fans sehen die Währung als ultimative Krisenversicherung. Doch der jüngste Crash beweist, dass sie ein Spekulationsobjekt bleibt – für das sich zusehends auch Profianleger begeistern. Wie passt das zusammen?",2021-12-08T23:41:12Z,Spiegel Online,Hype um Kryptowährungen: Warum der Bitcoin ein Spielball für Zocker bleibt - DER SPIEGEL,https://www.spiegel.de/wirtschaft/kryptowaehrungen-warum-der-bitcoin-ein-spielball-fuer-zocker-bleibt-a-2c4d3bdb-99c2-4da5-a55c-09aaabd5f529,https://cdn.prod.www.spiegel.de/images/fb31a435-7710-481b-a2a6-44fb42090496_w1280_r1.77_fpx33.33_fpy49.99.jpg
Manuel Schreiber,technology,"Der Panasonic TX-55JZW2004 im Überblick
Panasonic hat mit dem OLED-Fernseher TX-55JZW2004 ein echtes TV-Schwergewicht auf den Markt gebracht: Die Bildqualität ist erstklassig und glänzt unter andere… [+1754 chars]",deu,"Panasonic schraubt die Messlatte für Fernseher nach oben, denn das OLED-Modell TX-55JZW2004 ist der derzeit beste TV, der den Testparcours unseres Labors durchlaufen hat. Was der Fernseher im Detail kann, zeigen wir.",2021-12-08T18:49:00Z,CHIP Online Deutschland,Panasonic lässt die Konkurrenz alt aussehen: Das ist der beste Fernseher im Test - CHIP Online Deutschland,https://www.chip.de/news/Panasonic-laesst-die-Konkurrenz-alt-aussehen-Das-ist-der-beste-Fernseher-im-Test_183988548.html,https://www.chip.de/ii/1/2/6/5/5/8/1/6/4/5ed5797af57bdc3d.jpeg
Benjamin Mamerow,technology,"Android 12L soll bald erscheinen und sich an Geräte mit größerem Display richten, also Tablets, Chromebooks und Foldables. Besser gesagt kommuniziert Google 12L als Feature-Drop für Android 12, das M… [+1060 chars]",deu,"Android 12L soll bald erscheinen und sich an Geräte mit größerem Display richten, also Tablets, Chromebooks und Foldables. Besser gesagt ...",2021-12-08T18:23:00Z,Caschys Blog,Android 12L: Erste Beta veröffentlicht - Caschys Blog,https://stadt-bremerhaven.de/android-12l-erste-beta-veroeffentlicht/,https://stadt-bremerhaven.de/wp-content/uploads/2019/08/Android-logo.jpg
Moritz Draht,technology,Die Gaming-Industrie setzt verstärkt auf die Einbindung von NFTs für authentischere Spielerlebnisse und lukrative Nebenverdienste. Nachdem Spielegigant Ubisoft die Verwendung der Tezos Blockchain pub… [+2662 chars],deu,"Nachdem Spielegigant Ubisoft die Verwendung der Tezos Blockchain für einen NFT-Marktplatz publik gemacht hat, befindet sich der XTZ-Kurs im Höhenflug.",2021-12-08T17:33:26Z,Btc-echo.de,Tezos-Kurs (XTZ) explodiert nach Ubisoft-Integration - BTC-ECHO | Bitcoin & Blockchain Pioneers,https://www.btc-echo.de/news/tezos-kurs-explodiert-nach-ubisoft-integration-130873/,https://www.btc-echo.de/wp-content/uploads/2021/12/Tezos_2087469439-scaled.jpg
Roland Quandt,technology,"Microsoft hat offenbar einen Weg gefunden, um illegal ko­pier­te Versionen seines Büropakets Office zu erkennen und bie­tet den Nutzern dieser Ausgaben über ein Banner in der Be­nut­zer­ober­flä­che … [+1993 chars]",deu,"Microsoft hat offenbar einen Weg gefunden, um illegal ko­pier­te Versionen seines Büropakets Office zu erkennen und bie­tet den Nutzern dieser Ausgaben über ein Banner in der Be­nut­zer­ober­flä­che wohl einen Rabatt auf den Kauf einer le­ga­len Li­zenz an.",2021-12-08T16:19:00Z,WinFuture,"Microsoft erkennt geklaute Office-Installationen, bietet 50% Rabatt - WinFuture","https://winfuture.de/news,126901.html",https://i.wfcdn.de/teaser/1920/39142.jpg
Katja Schmidt,technology,"Wer auf der Suche nach neuer Haustechnik ist oder sein Smarthome aufrüsten möchte, kann heute bei Amazon viel Geld sparen. Der Onlineriese reduziert von der Überwachungskamera bis zur Wetterstation z… [+3959 chars]",deu,"Neue Haustechnik anschaffen oder das Smarthome aufrüsten: Amazon reduziert zahlreiche smarte Geräte von Netatmo. Wir zeigen, welche Angebote sich wirklich lohnen.",2021-12-08T16:05:45Z,t-online.de,"Überwachungskamera, Wetterstation und Co.: Haustechnik von Netatmo stark reduziert - t-online.de",https://www.t-online.de/ratgeber/id_91287390/ueberwachungskamera-wetterstation-und-co-haustechnik-von-netatmo-stark-reduziert.html,https://bilder.t-online.de/b/91/28/79/86/id_91287986/tid_da/heute-ist-unter-anderem-eine-ueberwachungskamera-des-herstellers-netatmo-radikal-reduziert-.jpg
André Westphal,technology,Square Enix hat heute den RPG-Klassiker „Legend of Mana“ als Neuauflage für mobile Endgeräte veröffentlicht. Ihr findet das Spiel direkt hier für Apple iOS und wiederum direkt hier für Android im Pla… [+1440 chars],deu,"Square Enix hat heute den RPG-Klassiker ""Legend of Mana"" als Neuauflage für mobile Endgeräte veröffentlicht. Ihr findet das Spiel direkt ...",2021-12-08T16:00:00Z,Caschys Blog,„Legend of Mana“: Neuauflage des RPG-Klassikers ab sofort für Android und Apple iOS - Caschys Blog,https://stadt-bremerhaven.de/legend-of-mana-neuauflage-des-rpg-klassikers-ab-sofort-fuer-android-und-apple-ios/,https://stadt-bremerhaven.de/wp-content/uploads/2021/12/Legend-of-Mana-Mobile.jpg
,technology,,fra,,2021-12-09T09:45:45Z,Google News,Facturer les clients refusant Linky ? La présidente d’Enedis s’explique - Ouest-France,https://news.google.com/__i/rss/rd/articles/CBMisQFodHRwczovL3d3dy5vdWVzdC1mcmFuY2UuZnIvZWNvbm9taWUvZW50cmVwcmlzZXMvZW5lZGlzL2NvbXB0ZXVyLWxpbmt5L2ZhY3R1cmVyLWxlcy1jbGllbnRzLXJlZnVzYW50LWxpbmt5LWxhLXByZXNpZGVudGUtZC1lbmVkaXMtcy1leHBsaXF1ZS03MTMyNzdmMi01ODUxLTExZWMtOWE0Ny00MWVlNThkNmE4ODbSAQA?oc=5,
Laurence,technology,"Depuis son lancement, l'Airtag a donné lieu à de nombreux tests entre le démontage en règle et les tracking les plus farfelus. Ainsi, un utilisateur britannique -résidant à Stratford-upon-Avon (patri… [+1246 chars]",fra,"Depuis son lancement, l'Airtag a donné lieu à de nombreux tests entre le démontage en règle et les tracking les plus farfelus. Ainsi, un utilisateur…",2021-12-09T09:44:46Z,Mac4ever,Un YouTubeur utilise des AirTags pour tester les envois par DHL - Forum,https://www.mac4ever.com/divers/168339-un-youtubeur-utilise-des-airtags-pour-tester-les-envois-par-dhl,https://img-api.mac4ever.com/1200x900:160;0:960;720/d430f02d70_122516-insolite-il-envoie-un-airtag-a-tim-cook-par-la-poste-et-aussi-a-elon-musk.jpg
Benjamin Logerot,technology,"Alors que les technologies embarquées dans nos voitures ne cessent de saméliorer, celle de l'autopilote, notamment dans les voitures Tesla, mériterait un petit coup de frais pour éviter de trop grand… [+3245 chars]",fra,"Alors que les technologies embarquées dans nos voitures ne cessent de s’améliorer, celle de l'autopilote, notamment dans les voitures Tesla, mériterait un petit coup de frais pour éviter de trop grandes distractions parfois mortelles. Comme jouer au Solitaire…",2021-12-09T09:25:00Z,Clubic,"Tesla : jouer ou conduire, pas besoin de choisir (mais ça fait un peu peur) - Clubic",https://www.clubic.com/pro/entreprises/tesla/actualite-397845-tesla-jouer-ou-conduire-pas-besoin-de-choisir-mais-ca-fait-un-peu-peur.html,https://pic.clubic.com/v1/images/1735830/raw?width=900&height=600&fit=max&hash=89951f5c9fdfde9aadc33204060b9afe25bebe9a
Romain Ribout,technology,"Si vous attendiez les promotions de fin d'année pour trouver une bonne affaire concernant la meilleure tablette d'Apple, c'est aujourd'hui que ça se passe. Chez la Fnac et Darty, l'iPad Pro M1, en 11… [+5446 chars]",fra,"Si vous attendiez les promotions de fin d'année pour trouver une bonne affaire concernant la meilleure tablette d'Apple, c'est aujourd'hui que ça se passe. Chez la Fnac et Darty, l'iPad Pro M1, en 11 et 12,9 pouces, est à prix réduit, avec des réductions alla…",2021-12-09T09:22:40Z,Frandroid,Fnac et Darty font chuter les prix de l’iPad Pro M1 pour les fêtes de Noël - Frandroid,https://www.frandroid.com/bons-plans/1150887_fnac-et-darty-font-chuter-les-prix-de-lipad-pro-m1-pour-les-fetes-de-noel,https://images.frandroid.com/wp-content/uploads/2021/12/ipad-pro-m1-source-apple.jpg
Mon Livret,technology,"En quelques heures seulement, samedi, 5,4 milliards de dollars de contrats à terme sur BTC ont été liquidés, vidant le marché de 25% de sa valeur, selon le rapport hebdomadaire de Glassnode. Il s’agi… [+2758 chars]",fra,"En quelques heures seulement, samedi, 5,4 milliards de dollars de contrats à terme sur BTC ont été liquidés, v",2021-12-09T09:10:52Z,Mon-livret.fr,Le krach du bitcoin a marqué la deuxième plus grande liquidation des contrats à terme cette année. - Mon Livret,https://www.mon-livret.fr/le-krach-du-bitcoin-a-marque-la-deuxieme-plus-grande-liquidation-des-contrats-a-terme-cette-annee.html,https://www.mon-livret.fr/wp-content/uploads/2021/11/bitcoin-argent.jpeg
Margot Marin,technology,"Ce nest pas la première fois quun rapprochement est fait entre le géant des GAFAM, Google, et la société crypto Chainlink. En août dernier, ces deux sociétés ont conclu un partenariat afin délaborer … [+3172 chars]",fra,"Éric Schmidt, ancien PDG de Google rejoint l’aventure Chainlink ! Il sera en charge de la stratégie de déploiement des oracles de Chainlink.",2021-12-09T09:00:00Z,Journalducoin.com,"L’ancien PDG de Google, Éric Schmidt rejoint Chainlink (LINK) - Journal du Coin",https://journalducoin.com/actualites/lancien-pdg-de-google-eric-schmidt-rejoint-chainlink-link/,https://journalducoin-com.exactdn.com/wp-content/uploads/2021/05/chainlink.jpg?strip=all&lossy=1&quality=66&ssl=1
https://www.facebook.com/laplumedemarine/,technology,"Barry Sternlicht optimiste sur lavenir du Bitcoin
Le milliardaire et président de Starwood Capital Group a fait part de son opinion dans le cadre dun événement organisé par Bloomberg. Barry Sternlic… [+2011 chars]",fra,Un Bitcoin (BTC) à un million de dollars : c'est le scénario envisagé par le milliardaire Barry Sternlicht,2021-12-09T09:00:00Z,Cryptoast.fr,Le milliardaire Barry Sternlicht estime que le Bitcoin (BTC) pourrait atteindre 1 million de dollars - Cryptoast,https://cryptoast.fr/milliardaire-barry-sternlicht-bitcoin-btc-un-million-dollars/,https://cryptoast.fr/wp-content/uploads/2021/12/barry-sternlicht-bitcoin-mlliardaire-.jpg
Grégoire Huvelin,technology,"Selon SamMobile, le Samsung Galaxy S21 FE devrait avoir droit à Android 12 dès sa sortie. Au premier abord anodine, cette particularité fera pourtant de lui un smartphone bien plus intéressant que le… [+2672 chars]",fra,"Selon SamMobile, le Samsung Galaxy S21 FE devrait avoir droit à Android 12 dès sa sortie. Au premier abord anodine, cette particularité fera pourtant de lui un smartphone bien plus intéressant que les autres Galaxy S21 en matière d’expérience logicielle.",2021-12-09T08:47:46Z,Frandroid,Le Samsung Galaxy S21 FE aurait un atout de poids que les autres S21 n’ont pas - Frandroid,https://www.frandroid.com/marques/samsung/1150909_le-samsung-galaxy-s21-fe-aurait-un-atout-de-poids-que-les-autres-s21-nont-pas,https://images.frandroid.com/wp-content/uploads/2021/04/samsung-galaxy-s21-fe-2-scaled.jpeg
Geoffroy Husson,technology,"La prochaine mise à jour de macOS va permettre aux applications d'adapter leurs menus à l'encoche en haut de l'écran des nouveaux MacBook Pro. 
Le MacBook Pro 14 M1 // Source : Arnaud Gelineau Frand… [+2430 chars]",fra,La prochaine mise à jour de macOS va permettre aux applications d'adapter leurs menus à l'encoche en haut de l'écran des nouveaux MacBook Pro.,2021-12-09T08:43:59Z,Frandroid,MacBook Pro : Apple corrige la principale critique adressée à son encoche - Frandroid,https://www.frandroid.com/marques/apple/1150881_macbook-pro-apple-corrige-la-principale-critique-adressee-a-son-encoche,https://images.frandroid.com/wp-content/uploads/2021/11/apple-macbook-pro-14-m1-pro-test-frandroid-4-scaled.jpg
,technology,"La DAO de BlackPool (BPT) se renforce
La fonds décentralisé BlackPool embarque un panel de nouveaux investisseurs de premier plan pour continuer de s'immiscer dans le secteur des tokens non fongible… [+2976 chars]",fra,"Le fonds décentralisé BlackPool (BPT), qui gère une importante collection de tokens non fongibles (NFTs) vient de lever 6 millions de dollars",2021-12-09T08:15:00Z,Cryptoast.fr,Le fonds décentralisé BlackPool lève 6 millions de dollars pour continuer sa conquête des metaverses - Cryptoast,https://cryptoast.fr/fonds-blackpool-bpt-leve-6-millions-dollars-conquete-metaverses/,https://cryptoast.fr/wp-content/uploads/2021/12/fonds-blackpool-bpt-leve-6-millions-dollars-conquete-metaverses.jpg
Rémy R.,technology,"Espions et bitcoins en eaux troubles –Si lon savait déjà, depuis août 2021, que le Mossad (les services secrets israéliens) recrutait des spécialistes en cryptomonnaies, les intentions de la CIA néta… [+2923 chars]",fra,Les intentions de la CIA sur Bitcoin s’éclaircissent. Son directeur vient enfin de confirmer les crypto-projets de l'agence.,2021-12-09T08:00:00Z,Journalducoin.com,Bitcoin et la CIA : les projets cryptos de l’Agence dévoilés - Journal du Coin,https://journalducoin.com/?p=441978,https://journalducoin-com.exactdn.com/wp-content/uploads/2021/12/cia.jpg
Geoffroy Husson,technology,"Oppo va présenter la semaine prochaine son premier smartphone pliant, l'Oppo Find N, un smartphone pliant conçu pour faire face au Galaxy Z Fold 3
LOppo Find N // Source : Oppo
Après avoir dévoilé … [+2636 chars]",fra,"Oppo va présenter la semaine prochaine son premier smartphone pliant, l'Oppo Find N, un smartphone pliant conçu pour faire face au Galaxy Z Fold 3",2021-12-09T07:58:39Z,Frandroid,L’Oppo Find N compte s’attaquer directement au Samsung Galaxy Z Fold 3 - Frandroid,https://www.frandroid.com/marques/oppo/1150865_loppo-find-n-compte-sattaquer-directement-au-samsung-galaxy-z-fold-3,https://images.frandroid.com/wp-content/uploads/2021/12/oppo-find-n.jpg
Mélanie Capelli,technology,"Le OnePlus Nord 2 est un smartphone milieu de gamme qui reprend quelques spécificités des plus premium. Le design, la fiche technique, la charge rapide tout y est sur ce midship killer. Pour couronne… [+4014 chars]",fra,"Le OnePlus Nord 2 est un smartphone milieu de gamme qui reprend quelques spécificités des plus premium. Le design, la fiche technique, la charge rapide tout y est sur ce midship killer. Pour couronner le tout, en ce moment Amazon propose la version 12+256 Go …",2021-12-09T07:55:12Z,Frandroid,Le modèle 12+256 Go du OnePlus Nord 2 est 100 € moins cher sur Amazon - Frandroid,https://www.frandroid.com/bons-plans/1144897_oneplus-nord-2-modele-12-256-go-promotion-amazon,https://images.frandroid.com/wp-content/uploads/2021/07/oneplus-nord-2-shooting-1-scaled.jpg
Amandine Jonniaux,technology,"La fin de lannée est loccasion de faire le bilan, et les stores en ligne de Google et Apple néchappent pas à la règle.Qui dit décembre dit bilans en tous genres. Alors que Google dévoilait il y a peu… [+2405 chars]",fra,"La fin de l’année est l’occasion de faire le bilan, et les stores en ligne de Google et Apple n’échappent pas à la règle.",2021-12-09T07:30:43Z,Journal du geek,Smartphones : voici les apps les plus populaires de 2021 - Journal du geek,https://www.journaldugeek.com/2021/12/09/smartphones-voici-les-apps-les-plus-populaires-de-2021/,https://www.journaldugeek.com/content/uploads/2021/12/template-jdg-2021-12-08t152536-421.jpg
,technology,"Des millions de bitcoins, une identité secrète bien gardée, un procès retentissant entre un entrepreneur et la famille dun de ses collègues décédés. Lhistoire du bitcoin vient de gagner un nouveau ch… [+3671 chars]",fra,"Des millions de bitcoins, une identité secrète bien gardée, un procès retentissant entre un entrepreneur et la famille d'un de ses collègues décédés. L'histoire du bitcoin vient de gagner un nouveau chapitre, toujours aussi rocambolesque. C’est un procès d’im…",2021-12-09T06:30:00Z,Numerama,««« L’inventeur »»» du bitcoin remporte un procès et garde ses milliards - Numerama,https://www.numerama.com/tech/784359-linventeur-du-bitcoin-remporte-un-proces-et-garde-ses-milliards.html,https://www.numerama.com/wp-content/uploads/2021/11/bitcoin3.jpg
Aurélien LAGNY,technology,"Le mois de janvier sera un gros mois pour les verts. Outre la petite GeForce RTX 3050, NVIDIA devrait aussi lancer la grosse GeForce RTX 3090 Ti. Une carte qui exploitera un GA102-350 avec pas moins … [+665 chars]",fra,"Le mois de janvier sera un gros mois pour les verts. Outre la petite GeForce RTX 3050, NVIDIA devrait aussi lancer la grosse G..., actualité 79098",2021-12-09T06:05:00Z,Cowcotland.com,"La GeForce RTX 3090 Ti par NVIDIA débarquera, elle aussi, le 27 janvier prochain - Cowcotland",https://www.cowcotland.com/news/79098/la-geforce-rtx-3090-ti-par-nvidia-debarquera-elle-aussi-le-27-janvier-prochain.html,/images/news/2021/12/lancement-geforce-rtx3090ti-nvidia27-janvier-f.jpg
Geoffroy Husson,technology,"Vous navez pas eu le temps de suivre lactualité hier? Voici ce qui a marqué le mercredi 8 décembre : M6 va disparaître de Molotov, Apple met un coup d'arrêt à la production d'iPhone et Google TV prop… [+2344 chars]",fra,"Vous n’avez pas eu le temps de suivre l’actualité hier ? Voici ce qui a marqué le mercredi 8 décembre : M6 va disparaître de Molotov, Apple met un coup d'arrêt à la production d'iPhone et Google TV propose des chaînes en direct. Pour ne manquer aucune actuali…",2021-12-09T06:00:42Z,Frandroid,"Fin de M6 sur Molotov, coup d’arrêt pour la production d’iPhone et chaînes en direct sur Google TV – Tech’spresso - Frandroid",https://www.frandroid.com/?p=1150735,https://images.frandroid.com/wp-content/uploads/2021/10/pro-max-mini-1200x706.jpg
Charlie Perreau,technology,L'heure du bilan de la French Tech n'a pas encore sonné mais certaines conclusions sont déjà connues. La fintech est l'un des secteurs tech les plus dynamiques en cette fin d'année 2021. Depuis septe… [+708 chars],fra,"Depuis la rentrée 2021, les start-up de la finance battent des records en termes de levées de fonds. Le secteur n'a jamais autant produit de licornes dont le spécialiste de la gestion des dépenses professionnelles Spendesk, selon nos informations.",2021-12-09T05:50:51Z,Les Echos,"Lydia, Spendesk, Swile… la folle fin d'année de la fintech française - Les Échos",https://www.lesechos.fr/start-up/deals/lydia-spendesk-swile-la-folle-fin-dannee-de-la-fintech-francaise-1371022,https://media.lesechos.com/api/v1/images/view/61b199153e454604e41537d6/1280x720/070492917345-web-tete.jpg
Matt_Clank,technology,"Razer lance la toute première génération de refroidisseurs pour Smartphones ! En effet, suite à la remise en avant du système de recharge par induction avec la marque MagSafe, Razer a emboîté le pas … [+2260 chars]",fra,"Razer lance la toute première génération de refroidisseurs pour Smartphones ! En effet, suite à la remise en avant du système de recharge par induction avec la marque MagSafe, Razer a emboîté le pas pour profiter d’ores et déjà une solution pour refroidir vot…",2021-12-09T05:50:01Z,jeuxvideo.com,Voici les refroidisseurs pour smartphone ! - jeuxvideo.com,https://www.jeuxvideo.com/news/1504123/voici-les-refroidisseurs-pour-smartphone.htm,https://image.jeuxvideo.com/medias-md/163899/1638985326-7051-card.png
Zoé De la Roche,technology,"Indécision – Bitcoin (BTC) se maintient au-dessus des 50 000 $. Sur le court terme, les taureaux tentent déviter une baisse à des niveaux bien en-dessous de ces derniers, alors que sur une échelle de… [+2711 chars]",fra,Bitcoin (BTC) se maintient au-dessus des 50 000 $. Les taureaux doivent défendre un support essentiel aux 48 700 $ pour éviter une autre chute,2021-12-08T21:09:00Z,Journalducoin.com,Bitcoin le 8 décembre 2021 – En plein stress-test - Journal du Coin,https://journalducoin.com/bitcoin/bitcoin-le-8-decembre-2021-en-plein-stress-test/,https://journalducoin-com.exactdn.com/wp-content/uploads/2021/12/CoursBTC-2021-6.jpg
Sam Byford,technology,"No word on whether therell be other controllers
Illustration by Alex Castro / The Verge
Apples widely rumored upcoming mixed reality headset will make use of 3D sensors for advanced hand tracking, … [+1711 chars]",usa,Analyst Ming-chi Kuo says Apple’s AR headset will use advanced 3D sensors for a hand-tracking interface. A second model may follow in 2024.,2021-12-09T07:42:59Z,The Verge,Apple’s AR headset reportedly uses 3D sensors for hand tracking - The Verge,https://www.theverge.com/2021/12/9/22825675/apple-ar-headset-hand-tracking-controllers-kuo-report,https://cdn.vox-cdn.com/thumbor/OxG-lK1qr3seajbOwkAnEaKPXSY=/0x146:2040x1214/fit-in/1200x630/cdn.vox-cdn.com/uploads/chorus_asset/file/8964123/acastro_170731_1777_0005_v4.jpg
,technology,"Dr Disrespect has ripped into Warzone’s new Pacific update on launch day, repetitively claiming he’s “falling asleep” and is already considering uninstalling the Call of Duty battle royale despite it… [+3203 chars]",usa,Dr Disrespect has backflipped on his Warzone Pacific hype immediately and is on the verge of uninstalling the Call of Duty battle royale.,2021-12-09T07:03:08Z,Dexerto,Dr Disrespect has huge problems with Warzone Pacific: “I’m ready to uninstall” - Dexerto,https://www.dexerto.com/call-of-duty/dr-disrespect-has-huge-problems-with-warzone-pacific-already-1716951/,https://www.dexerto.com/wp-content/uploads/2021/12/09/dr-disrespect-has-huge-problems-with-warzone-pacific-already-ready-to-uninstall-game.jpg
