author,category,content,country,description,publishedAt,source,title,url,urlToImage
n-tv NACHRICHTEN,general,"Die asiatischen Börsen haben heute keine gemeinsame Richtung eingeschlagen. Während die Anleger in Japan vor den kommenden Notenbanksitzungen Kasse machten, beflügelten in China Spekulationen auf wei… [+1002 chars]",deu,Der Börsen-Tag,2021-12-09T10:30:00Z,N-tv.de,"Der Börsen-Tag am Donnerstag, 9. Dezember 2021 - n-tv.de - n-tv NACHRICHTEN",https://www.n-tv.de/wirtschaft/der_boersen_tag/Der-Boersen-Tag-am-Donnerstag-9-Dezember-2021-article22987104.html,https://bilder1.n-tv.de/img/incoming/crop22737764/9401321114-cImg_16_9-w1200/215634685.jpg
dpa STATISTISCH,general,"Heute früh könnte sich einer der letzten Chancen ergeben, den Kometen C/2021 A1 (Leonard) - mit einem Fernglas! - am Morgenhimmel zu finden: Hier der Anblick um 5 Uhr, mit dem Kometen auf halben Weg … [+158 chars]",deu,Der Anfang des Jahres entdeckte Komet „C/2021 A1 Leonard“ fliegt am kommenden Wochenende an der Erde vorbei und könnte am Morgenhimmel sichtbar werden.,2021-12-09T10:24:00Z,Www.swp.de,Komet Leonard: Einmaliges Schauspiel: Komet fliegt an Erde vorbei - Wann kann ich ihn am besten sehen? - SWP,https://www.swp.de/panorama/komet-c2021-a1-leonard-fliegt-an-erde-vorbei-wann-am-besten-beobachten-61371425.html,https://www.swp.de/imgs/07/9/3/1/2/4/4/4/5/tok_c2e7af85ed51af786b44888e1e805ddb/w1176_h662_x750_y524_5FA710008BD6C1C3.jpg-121143e06c98d6c5.jpeg
Daniel Herbig,general,"Ubisoft bietet erstmals NFT-Inhalte für eines seiner großen Videospiele an: Bald sollen Spielerinnen und Spieler einzigartige Ausrüstungsstücke für den Online-Shooter ""Ghost Recon Breakpoint"" kaufen … [+4542 chars]",deu,"Ubisoft verteilt erstmals NFT-Gegenstände für einen Online-Shooter: Für ""Ghost Recon Breakpoint"" gibt es bald einzigartige Helme und Waffen.",2021-12-09T09:49:00Z,heise online,"Ubisoft Quartz: NFT-Ausrüstung für Shooter ""Ghost Recon Breakpoint"" - heise online",https://www.heise.de/news/Ubisoft-Quartz-NFT-Ausruestung-fuer-Shooter-Ghost-Recon-Breakpoint-6290190.html,https://heise.cloudimg.io/bound/1200x1200/q85.png-lossy-85.webp-lossy-85.foil1/_www-heise-de_/imgs/18/3/2/2/9/4/9/2/auto-a9e701751ef5f311.webp
Candriam,general,"In der Onkologie hat es in den letzten Jahrzehnten einige bemerkenswerte Fortschritte gegeben. Krebs ist ein schwieriger und komplexer Feind. Es gibt über 200 Arten dieser Krankheit, und sie ändern s… [+8029 chars]",deu,"Der Kampf der Forschung gegen den Krebs schreitet voran. Neue Therapieansätze mit weniger Nebenwirkungen lassen auf effektivere Behandlungen hoffen. Als besonders spannend sieht Malgorzata Kluba, Senior Biotechnology Analyst bei Candriam, derzeit die Entwickl…",2021-12-09T09:31:00Z,Dasinvestment.com,Anlagethema Onkologie Krebserkrankungen gezielt bekämpfen - DAS INVESTMENT.com,https://www.dasinvestment.com/krebserkrankungen-gezielt-bekaempfen/,https://www.dasinvestment.com/uploads/images/teaser/slider/big/1639042564-Malgorzata_Kluba.jpg
Jan Drebes,general,"9. Dezember 2021 um 11:28 Uhr
Berlin Der öffentliche Druck war enorm, dass Karl Lauterbach neuer Gesundheitsminister werden soll. Jetzt ist es so weit. Künftig ist der Sozialdemokrat vorderster Coro… [+3619 chars]",deu,"Der öffentliche Druck war enorm, dass Karl Lauterbach neuer Gesundheitsminister werden soll. Jetzt ist es so weit. Künftig ist der Sozialdemokrat vorderster Corona-Bekämpfer. Amtsvorgänger Jens Spahn nimmt mit emotionalen Worten Abschied vom Ministerium im Au…",2021-12-09T09:28:00Z,RP ONLINE,Neuer Gesundheitsminister Karl Lauterbach - SPD-Politiker übernimmt Gesundheitsministerium von Jens Spahn - RP ONLINE,https://rp-online.de/politik/deutschland/neuer-gesundheitsminister-karl-lauterbach-spd-politiker-uebernimmt-gesundheitsministerium-von-jens-spahn_aid-64506373,https://rp-online.de/imgs/32/1/1/9/7/2/4/8/7/9/tok_96e492e3baae3dfa51ee39fc54fc87e8/w1200_h630_x600_y329_DPA_bfunk_dpa_5FA4E60081986B4C-0cfec11a77cb8d36.jpg
Laurena Lynn Erdmann,general,"Eine Krebserkrankung kann viele Ursachen haben. Entscheidend kann dabei auch der Lebensstil sein. Bewegung, Ernährung, Umfeld: Hier erfahren Sie acht Tipps, wie Sie das Krebsrisiko senken können.
Be… [+575 chars]",deu,"Eine Krebserkrankung kann viele Ursachen haben. Entscheidend kann dabei auch der Lebensstil sein. Bewegung, Ernährung, U",2021-12-09T09:20:00Z,Www.svz.de,Gesund leben: Acht Tipps: So beugen Sie einer Krebserkrankung vor | svz.de - svz.de,https://www.svz.de/ratgeber/medizin-gesundheit/Krebsvorsorge-Mit-diesen-acht-Tipps-leben-Sie-gesuender-id34571042.html,https://www.svz.de/img/medizin-gesundheit/crop34571022/7668154599-cv16_9-w596-fnov-fpi27439937-fpx250-fpym140/eine-operation-ist-bei-vielen-krebsarten-bestandte-202112031644-full.jpg
tagesschau,general,"Die Sieben-Tage-Inzidenz in Deutschland ist erneut leicht gesunken - auf 422,3. Das Robert Koch-Institut meldete mehr als 70.000 Neuinfektionen und 465 Todesfälle. Bei der Übermittlung der Zahlen gab… [+2196 chars]",deu,"Die Sieben-Tage-Inzidenz in Deutschland ist erneut leicht gesunken - auf 422,3. Das Robert Koch-Institut meldete mehr als 70.000 Neuinfektionen und 465 Todesfälle. Bei der Übermittlung der Zahlen gab es Probleme.",2021-12-09T09:17:10Z,tagesschau.de,Corona-Pandemie: RKI meldet 70.611 Neuinfektionen | tagesschau.de - tagesschau.de,https://www.tagesschau.de/inland/corona-rki-zahlen-139.html,https://www.tagesschau.de/multimedia/bilder/coronatest-125~_v-original.jpg
SPORT1,general,"Der FC Barcelona hat eine historische Schmach erlitten.
Nach dem Spiel war Clément Lenglet zu sehen, wie er mit Bayern-Stürmer Robert Lewandowski lachte. Die Szene des Barca-Verteidigers, der in der… [+817 chars]",deu,Clément Lenglet lacht nach dem Barca-Aus mit Robert Lewandowski. Fans und Medien sind empört.,2021-12-09T09:15:23Z,SPORT1,Barca-Fans empört: Lenglet lacht mit Bayern-Star Lewandowski - SPORT1,https://www.sport1.de/news/fussball/champions-league/2021/12/barca-fans-emport-lenglet-lacht-mit-bayern-star-lewandowski,https://reshape.sport1.de/c/t/c07cd33b-2869-4d48-9666-e1e22e5e7146/1200x630
,general,"Stand: 09.12.2021 11:37 Uhr
Im Live-Ticker informiert NDR.de Sie auch heute - am Donnerstag, 9. Dezember 2021 - aktuell über die Folgen der Coronavirus-Pandemie für Niedersachsen, Schleswig-Holstein… [+18324 chars]",deu,Die Infektionen seien auf mehrere Bezirke verteilt und stünden nicht alle in Zusammenhang mit dem kürzlich bekannt gewordenen ersten Fall. Mehr Corona-News im Live-Ticker.,2021-12-09T09:01:17Z,Www.ndr.de,Corona-News-Ticker: Vier weitere Omikron-Fälle in Hamburg bestätigt - NDR.de,"https://www.ndr.de/nachrichten/info/Corona-News-Ticker-Vier-weitere-Omikron-Faelle-in-Hamburg-bestaetigt,coronaliveticker1446.html",https://www.ndr.de/nachrichten/hamburg/coronatest350_v-contentxl.jpg
Peter Carstens,general,Im Verteidigungsministerium hat die neue Ministerin Christine Lambrecht (SPD) offiziell das Amt übernommen. Lambrecht wurde am Mittwochabend am Bendlerblock von Generalinspekteur Eberhard Zorn mit mi… [+4334 chars],deu,Noch vor ihrem Eintreffen sorgt die neue Verteidigungsministerin für schlechte Stimmung im Haus. Annegret Kramp-Karrenbauer bleibt der Amtsübernahme fern – und hat offenbar Gründe.,2021-12-09T08:51:00Z,Faz.net,Frostige Amtsübernahme im Verteidigungsministerium - FAZ - Frankfurter Allgemeine Zeitung,https://www.faz.net/aktuell/politik/inland/lambrechts-amtsuebernahme-ohne-akk-im-verteidigungsministerium-17675076.html,https://media0.faz.net/ppmedia/aktuell/politik/228760300/1.7675082/facebook_teaser/antritt-ohne-uebergabe.jpg
WELT,general,"Die neue Bundesaußenministerin Annalena Baerbock hat die Klimapolitik als zentrale Aufgabe ihrer Arbeit bezeichnet. Ich werde vom ersten Tag an der internationalen Klimapolitik den Platz geben, den s… [+4317 chars]",deu,Die sich zuspitzende Ukraine-Krise dürfte einer der Schwerpunkte bei den ersten internationalen Gesprächen der neuen Außenministerin Baerbock sein. Vor ihrer Antrittsreise pocht sie auf Grundwerte wie die Rechtsstaatlichkeit.,2021-12-09T08:25:31Z,DIE WELT,Baerbock: Klimapolitik „ganz oben“ auf der diplomatischen Agenda - WELT,https://www.welt.de/politik/ausland/article235547402/Baerbock-Klimapolitik-ganz-oben-auf-der-diplomatischen-Agenda.html,https://img.welt.de/img/politik/ausland/mobile235547404/6811353117-ci16x9-w1200/Annalena-Baerbock-reist-nach-Paris.jpg
Clara Ott,general,Die Klimaschutzbewegung Fridays For Future erwartet von der neuen Bundesregierung und Klimaminister Robert Habeck (Grüne) ein hohes Tempo bei Klimaschutz-Maßnahmen. In den nächsten Jahren müssen die … [+5757 chars],deu,Große Erwartungen an Robert Habeck: „Fridays For Future“ fordert vom Klimaminister Tempo bei Klimaschutz-Maßnahmen. Wirtschafts- und Umweltverbände bezeichnen die Ziele der Ampel-Koalition als „äußerst ambitioniert“. Mehr im Liveticker.,2021-12-09T08:24:13Z,DIE WELT,Ampel-Koalition: „Herr Habeck wird liefern müssen“ - WELT,https://www.welt.de/politik/deutschland/article235546896/Ampel-Koalition-Herr-Habeck-wird-liefern-muessen.html,https://img.welt.de/img/politik/deutschland/mobile235547074/4521351827-ci16x9-w1200/UN-Klimakonferenz-COP26-in-Glasgow.jpg
DER SPIEGEL,general,"Die Zahl der weltweit inhaftierten Journalisten hat nach Angaben des Komitees zum Schutz von Journalisten (CPJ) einen neuen Höchststand erreicht. Wie das CPJ am Donnerstag mitteilte, sitzen derzeit 2… [+1772 chars]",deu,Zum sechsten Mal in Folge erreicht die Zahl inhaftierter Journalisten einen Höchststand. Die meisten Berichterstatter sitzen in chinesischen Gefängnissen – doch das gefährlichste Land bleibt ein anderes.,2021-12-09T08:06:29Z,Spiegel Online,Komitee zum Schutz von Journalisten: So viele Journalisten weltweit in Haft wie noch nie - DER SPIEGEL,https://www.spiegel.de/ausland/pressefreiheit-so-viele-journalisten-weltweit-in-haft-wie-noch-nie-a-b2076e18-51a4-4a25-a0eb-b5589524a469,https://cdn.prod.www.spiegel.de/images/bd314197-b530-4aa1-b3e5-fa118fd3d57f_w1280_r1.77_fpx54_fpy36.jpg
,general,<ul><li>Niedersachsen will nach Bund-Länder-Runde entscheiden</li><li>Landesregierung strebt möglichst einheitliche Regelung an</li><li>Forderung nach schneller Entscheidung</li></ul>Niedersachsen wi… [+2472 chars],deu,"Niedersachsen will heute entscheiden, ob die Weihnachtsferien vorgezogen und vielleicht sogar verlängert werden. Die Landesregierung will sich zunächst mit den anderen Ländern abstimmen.",2021-12-09T07:52:13Z,Butenunbinnen.de,Niedersachsen will über vorgezogene Weihnachtsferien entscheiden - buten un binnen,https://www.butenunbinnen.de/nachrichten/diskussion-weihnachtsferien-niedersachsen-100.html,https://www.butenunbinnen.de/bilder/dpa-12126~_v-1280x720_c-1639034627272.jpg
,general,"Der neue Bundesgesundheitsminister Karl Lauterbach hat die Wichtigkeit der Auffrischungsimpfungen im Kampf gegen die neue Corona-Variante Omikron unterstrichen. Die Impfung ist nur abgeschlossen, wen… [+1493 chars]",deu,"Bisher gilt: Wer zwei Impfungen bekommen hat, gilt als vollständig geimpft und erhält Einlass, wo 2G gilt. Das könnte sich wegen Omikron ändern.",2021-12-09T07:25:55Z,Der Tagesspiegel,Gesundheitsminister Lauterbach: „Brauchen drei Impfungen für Schutz gegen Omikron“ - Tagesspiegel,https://www.tagesspiegel.de/politik/gesundheitsminister-lauterbach-brauchen-drei-impfungen-fuer-schutz-gegen-omikron/27876958.html,https://www.tagesspiegel.de/images/amtsuebergabe-gesundheitsministerium/27876968/1-format530.jpg
"Anna-Lena Janzen, Martin Trotz",general,"Boris Johnson steht unter Druck. Ein geleaktes Video sorgt für Wirbel in Großbritannien und widerspricht der Darstellung des Premiers. Jetzt werden Rücktrittsforderungen laut.
Der britische Premier … [+2123 chars]",deu,"Boris Johnson steht unter Druck. Aufnahmen seiner Mitarbeiter legen nahe, dass trotz Corona-Regeln in seinem Amtssitz gefeiert wurde.",2021-12-09T07:18:00Z,t-online.de,Boris Johnson besucht Weihnachtsfeier trotz Lockdown – Opposition fordert Rücktritt - t-online.de,https://www.t-online.de/nachrichten/ausland/id_91282846/boris-johnson-besucht-weihnachtsfeier-trotz-lockdown-opposition-fordert-ruecktritt.html,https://bilder.t-online.de/b/91/29/13/34/id_91291334/tid_da/index.jpg
Oliver Das Gupta,general,"Mehr Perspektiven, mehr verstehen.
Freier Zugang zu allen Artikeln, Videos, Audioinhalten und Podcasts
<ul><li>
Alle Artikel auf SPIEGEL.de frei zugänglich
</li><li>
DER SPIEGEL als E-Paper und … [+735 chars]",deu,"Gerhard Karner gilt schon lange als umstritten: Er soll politische Gegner beschimpft haben und mit antisemitischen Äußerungen aufgefallen sein. Und dann ist da noch ein Museum, das einem Diktator huldigt.",2021-12-09T06:47:06Z,Spiegel Online,Regierungsumbildung in Österreich: Der neue Innenminister und sein Faschismusproblem - DER SPIEGEL,https://www.spiegel.de/ausland/oesterreich-wer-ist-der-neue-innenminister-gerhard-karner-a-290e440a-0e4a-40b3-b92b-fec3d50290c8,https://cdn.prod.www.spiegel.de/images/5ae92e0e-6f04-412e-82c3-e65f599ba0e5_w1280_r1.77_fpx62_fpy46.jpg
"VIP.de, Star News",general,"[Ich] kann sagen, dass es alles andere als schön ist, wenn der Körper nicht loslassen kann oder will. Es nicht schön für die Psyche und ganz und gar nicht schön für den Körper, erklärte Anna Wilken i… [+853 chars]",deu,"Anna Wilken erlitt vor etwa zwei Wochen eine Fehlgeburt. Da der Embryo jedoch nicht von allein abgeht, wagt die Influencerin jetzt einen mutigen Schritt.",2021-12-09T06:41:13Z,Www.vip.de,"Nach Fehlgeburt: Anna Wilken entscheidet sich für Saugkürettage - VIP.de, Star News",https://www.vip.de/cms/nach-fehlgeburt-anna-wilken-entscheidet-sich-fuer-saugkuerettage-4880638.html,https://aisvip-a.akamaihd.net/masters/1637089/ex-gntm-star-anna-wilken-ueber-ihre-fehlgeburt.jpg
Tim Ursinus,general,Eine Vertragsverlängerung mit Dan-Axel Zagadou ist bei Borussia Dortmund wohl noch kein Thema. Moderater Sebastian Pufpaff hat nach seinem Prank Stadionverbot. News und Gerüchte zum BVB im Überblick.… [+3523 chars],deu,Eine Vertragsverlängerung mit Dan-Axel Zagadou ist bei Borussia Dortmund wohl noch kein Thema. Moderater Sebastian Pufpaff hat nach seinem Prank Stadionverbot. News und Gerüchte zum BVB im Überblick.,2021-12-09T06:35:00Z,SPOX,BVB - News und Gerüchte: Vertragsverlängerung mit Dan-Axel Zagadou wohl noch kein Thema - SPOX,https://www.spox.com/de/sport/fussball/bundesliga/2112/Artikel/bvb-borussia-dortmund-news-und-geruechte-zagadou-tv-total-prank.html,https://www.spox.com/de/sport/fussball/bundesliga/2112/Bilder/zagadou-1200.jpg
n-tv NACHRICHTEN,general,Die Ausgangslage für das Saisonfinale der Formel 1 könnte nicht spannender sein. Der WM-Führende Max Verstappen ist punktgleich mit dem Zweiten Lewis Hamilton. Gibt es den großen Knall beim Großen Pr… [+5459 chars],deu,Die Ausgangslage für das Saisonfinale der Formel 1 könnte nicht spannender sein. Der WM-Führende Max Verstappen ist punktgleich mit dem Zweiten Lewis Hamilton. Gibt es den großen Knall beim Großen Preis von Abu Dhabi? Die Rivalen im Vergleich.,2021-12-09T06:24:37Z,N-tv.de,WM-Showdown in der Formel 1: Was für Verstappen spricht - und was für Hamilton - n-tv NACHRICHTEN,https://www.n-tv.de/sport/formel1/Was-fuer-Verstappen-spricht-und-was-fuer-Hamilton-article22986549.html,https://bilder2.n-tv.de/img/incoming/crop22986577/9541327072-cImg_16_9-w1200/imago1008488784h.jpg
"Jean-Michel Décugis, Ronan  Folgoas, Caroline Piquet",general,"Il est visé par une enquête préliminaire ouverte le 20 novembre pour agression sexuelle. Pierre Ménès a été convoqué puis placé ce jeudi en garde à vue, selon nos informations, confirmées depuis par … [+1508 chars]",fra,INFO LE PARISIEN. L’ancien journaliste de Canal + est mis en cause par une hôtesse du Parc des Princes pour des gestes déplacés possiblement commis lors du match PSG-Nantes le 20 novembre.,2021-12-09T10:17:00Z,Le Parisien,"Visé par une enquête pour «agression sexuelle», Pierre Ménès en garde à vue - Le Parisien",https://www.leparisien.fr/faits-divers/vise-par-une-enquete-pour-agression-sexuelle-pierre-menes-place-en-garde-a-vue-09-12-2021-3M2PETFM5ZCXHC6LPJGVK5CPYE.php,https://www.leparisien.fr/resizer/wYokwNenvRUbOgcxYWK9sC35cho=/1200x675/cloudfront-eu-central-1.images.arcpublishing.com/leparisien/G4R7IAJBW5BZTBJQMKTCWJOOEE.jpg
Vincent Bregevin,general,"La joie des Lillois après le but de Burak Yilmaz face à Wolfsbourg, le 8 décembre 2021 en Ligue des champions
Crédit: Getty Images",fra,Lille a brillamment décroché son billet pour les 8es de finale et terminé en tête de son groupe en s'imposant à Wolfsbourg (1-3) mercredi.,2021-12-09T09:51:00Z,Eurosport.fr,"L'antisèche de Wolfsbourg - Lille (1-3) : Les Dogues, comme des champions ! - Eurosport FR",https://www.eurosport.fr/football/ligue-des-champions/2021-2022/l-antiseche-de-wolfsbourg-lille-1-3-les-dogues-comme-des-champions_sto8664544/story.shtml,https://i.eurosport.com/2021/12/09/3268543-66888128-2560-1440.jpg
,general,L'ancienne joueuse de tennis professionnelle succède ainsi à Guy Forget à la tête du Gand Chelem parisien.Les Internationaux de France tiennent désormais leur nouvelle directrice. L'ancienne joueuse … [+1381 chars],fra,L'ancienne joueuse de tennis professionnelle succède ainsi à Guy Forget à la tête du Gand Chelem parisien.,2021-12-09T09:48:21Z,Francetvinfo.fr,Tennis : Amélie Mauresmo succède à Guy Forget à la direction de Roland-Garros - franceinfo,https://www.francetvinfo.fr/sports/tennis/masters-1000/tennis-amelie-mauresmo-succede-a-guy-forget-et-prend-la-direction-de-roland-garros_4872557.html,https://www.francetvinfo.fr/pictures/JldQ0OhQFktznmGxw2Nej1r3UgM/1500x843/2021/12/07/phpDeJQAe.jpg
Julien Laloye,general,"Le football français n’en finit pas de prendre de la hauteur. Après le show « Actor Studio » du directeur de la communication marseillais Jacques Cardoze à faire passer De Niro pour un amateur, c’est… [+1210 chars]",fra,"Comme l’OM, l’OL a dénoncé la décision de la commission de discipline de lui retirer un point",2021-12-09T09:40:45Z,20 Minutes,"Incidents OL-OM : Une décision « incompréhensible » pour Lyon, qui réfléchit aussi à faire appel - 20 Minutes",https://www.20minutes.fr/sport/3193331-20211209-incidents-ol-om-decision-incomprehensible-lyon-reflechit-aussi-faire-appel,https://img.20mn.fr/Mucx3p1rQVOMPyOB_l_9iSk/648x360_jean-michel-aulas-lors-presentation-jerome-boateng-aout-2020.jpg
Le Monde avec AFP,general,"Une étude parue en novembre dans la revue médicale « The Lancet », létude ComCor de lInstitut Pasteur réalisée du 23 mai au 13 août, avait conclu que les boîtes de nuit étaient « des lieux à haut ris… [+4116 chars]",fra,"Les danses seront interdites dans ces lieux à partir de vendredi matin jusqu’au 6 janvier inclus, période durant laquelle les discothèques devront aussi fermer leurs portes dans le cadre des nouvelles mesures anti-Covid.",2021-12-09T09:39:59Z,Le Monde,"Covid-19 : la France interdit de danser dans les bars et restaurants pendant quatre semaines, les pharmacies autorisées à ouvrir le dimanche - Le Monde",https://www.lemonde.fr/planete/article/2021/12/09/covid-19-la-france-interdit-de-danser-dans-les-bars-et-restaurants-pendant-quatre-semaines-les-pharmacies-autorisees-a-ouvrir-le-dimanche_6105309_3244.html,https://img.lemde.fr/2015/04/27/35/0/425/212/1440/720/60/0/9bc52fd_ill_1133988_watt.jpg
Sud Ouest,general,"Rebondissement dans laffaire Delphine Jubillar. Selon les journalistes de France 2, le 8 décembre, des nouvelles révélations concernant des SMS pourraient tout changer. Un an après la disparation de … [+1010 chars]",fra,Delphine Jubillar et l’épouse de son amant auraient conclu un pacte que l’infirmière de 33 ans n’aurait pas respecté. L’amant et son épouse vont être entendus sur ce point précis par les enquêteurs,2021-12-09T09:34:13Z,Sud Ouest,Disparition de Delphine Jubillar : pourquoi l’épouse de son amant est-elle dans le viseur des enquêteurs ? - Sud Ouest,https://www.sudouest.fr/faits-divers/disparition-de-delphine-jubillar-pourquoi-l-epouse-de-son-amant-est-elle-dans-le-viseur-des-enqueteurs-7285344.php,https://media.sudouest.fr/7285344/1200x-1/so-5fe4b29266a4bd3768392e61-ph0.jpg
Warial,general,"Les mois passent et la pénurie de PS5 continue ses ravages. Plus d'un an après la sortie de la console de Sony, il ne faut jamais plus de 5 minutes avant de voir une rupture de stock à chaque réassor… [+3647 chars]",fra,"Les mois passent et la pénurie de PS5 continue ses ravages. Plus d'un an après la sortie de la console de Sony, il ne faut jamais plus de 5 minutes avant de voir une rupture de stock à chaque réassort de PlayStation 5. Bonne nouvelle, il y en à aujourd'hui. M…",2021-12-09T09:33:25Z,jeuxvideo.com,La PS5 enfin de retour en stock à son prix de base ! - jeuxvideo.com,https://www.jeuxvideo.com/news/1500742/la-ps5-enfin-de-retour-en-stock-a-son-prix-de-base.htm,https://image.jeuxvideo.com/medias-md/163826/1638263083-6543-card.jpg
,general,,fra,,2021-12-09T09:24:28Z,Google News,"Tottenham – Stade Rennais. Match annulé, une date de report proposée par les Anglais - Ouest-France",https://news.google.com/__i/rss/rd/articles/CBMiogFodHRwczovL3d3dy5vdWVzdC1mcmFuY2UuZnIvc3BvcnQvZm9vdGJhbGwvc3RhZGUtcmVubmFpcy90b3R0ZW5oYW0tc3RhZGUtcmVubmFpcy1sLXVlZmEtY29uZmlybWUtbC1hbm51bGF0aW9uLWRlLWxhLXJlbmNvbnRyZS00Mjk4YWU2MC01OGNmLTExZWMtYTAxMC1kY2MxOGRhMjJjMDXSAQA?oc=5,
Le Figaro avec AFP,general,"Il aurait dû rembourser une échéance de 82,5 millions de dollars en novembre, repoussée à mardi.Le géant chinois de l'immobilier Evergrande, étranglé par une dette abyssale et dont la santé inquiète … [+384 chars]",fra,"Il aurait dû rembourser une échéance de 82,5 millions de dollars en novembre, repoussée à mardi.",2021-12-09T09:19:38Z,Lefigaro.fr,"Le promoteur chinois Evergrande a fait «défaut» sur un paiement, selon une agence de notation - Le Figaro",https://www.lefigaro.fr/flash-eco/le-promoteur-chinois-evergrande-a-fait-defaut-sur-un-paiement-selon-une-agence-de-notation-20211209,https://i.f1g.fr/media/cms/704x396_cropupscale/2021/12/09/aba3a45f9e539eb169d64823f22564a77249d36f8171b4378df98aecd66ebfd8.jpg
Sandrine Cassini,general,"Vincent Bolloré, propriétaire du groupe Vivendi, le 19 avril 2018. ERIC PIERMONT / AFP
Vincent Bolloré aurait-il décidé de boucler ses affaires avant sa retraite officielle le 17 février 2022 ? A la… [+2872 chars]",fra,Vincent Bolloré accélère la prise de contrôle du groupe sur lequel il avait annoncé une offre publique d’achat à la mi-septembre.,2021-12-09T09:17:39Z,Le Monde,Vivendi lancera son OPA sur le groupe Lagardère dès février 2022 - Le Monde,https://www.lemonde.fr/economie/article/2021/12/09/vivendi-lancera-son-opa-sur-le-groupe-lagardere-des-fevrier-2022_6105302_3234.html,https://img.lemde.fr/2021/12/09/0/0/2381/1188/1440/720/60/0/b436809_668133-000-9ub3ga.jpg
Grégoire Huvelin,general,"Selon SamMobile, le Samsung Galaxy S21 FE devrait avoir droit à Android 12 dès sa sortie. Au premier abord anodine, cette particularité fera pourtant de lui un smartphone bien plus intéressant que le… [+2672 chars]",fra,"Selon SamMobile, le Samsung Galaxy S21 FE devrait avoir droit à Android 12 dès sa sortie. Au premier abord anodine, cette particularité fera pourtant de lui un smartphone bien plus intéressant que les autres Galaxy S21 en matière d’expérience logicielle.",2021-12-09T08:47:46Z,Frandroid,Le Samsung Galaxy S21 FE aurait un atout de poids que les autres S21 n’ont pas - Frandroid,https://www.frandroid.com/marques/samsung/1150909_le-samsung-galaxy-s21-fe-aurait-un-atout-de-poids-que-les-autres-s21-nont-pas,https://images.frandroid.com/wp-content/uploads/2021/04/samsung-galaxy-s21-fe-2-scaled.jpeg
,general,"Olivier Véran, ministre de la Santé, était l'invité des ""4 Vérités"" sur France 2, jeudi 9 décembre.Sept régions ont d'ores et déjà déclenché le plan blanc face à la propagation du Covid-19. Il sera ""… [+1457 chars]",fra,"Olivier Véran, ministre de la Santé, était l'invité des ""4 Vérités"" sur France 2, jeudi 9 décembre.",2021-12-09T08:38:47Z,Francetvinfo.fr,"Covid-19 : ""le plan blanc sera probablement national d'ici à quelques jours"", affirme Olivier Véran - Franceinfo",https://www.francetvinfo.fr/sante/maladie/coronavirus/vaccin/covid-19-le-plan-blanc-sera-probablement-national-d-ici-a-quelques-jours-affirme-olivier-veran_4874825.html,https://www.francetvinfo.fr/pictures/V_ZrvjTNcFhtN0LmzCagv9bdi90/1500x843/2021/12/09/phpAZHP3v.png
,general,"Le ministre de l'Éducation nationale, de la jeunesse et des sports a annoncé jeudi que la France ne suivrait pas le boycott diplomatique lancé par les Etats-Unis.La France ne suivra pas le boycott di… [+1694 chars]",fra,"Le ministre de l'Éducation nationale, de la jeunesse et des sports a annoncé jeudi que la France ne suivrait pas le boycott diplomatique lancé par les Etats-Unis.",2021-12-09T08:24:16Z,Francetvinfo.fr,"JO 2022 : contrairement aux Etats-Unis, la France ne participera pas au boycott diplomatique - franceinfo",https://www.francetvinfo.fr/les-jeux-olympiques/jo-2022-la-france-ne-boycottera-pas-diplomatiquement-les-jeux-de-pekin-annonce-jean-michel-blanquer_4874809.html,https://www.francetvinfo.fr/pictures/BHH7Wj_xZTb2BS4WZLbMiQ6-7XM/1500x843/2021/12/09/php6kNYvz.jpg
