author,category,content,country,description,publishedAt,source,title,url,urlToImage
https://www.engadget.com/about/editors/mat-smith,science,"NASA's Hubble telescope has been in a month-long nap since going into system failure in late October. However, early yesterday, the agency announced it is waking Hubble up. NASA says the telescope is… [+4624 chars]",usa,"Today’s tech headlines: 
The Hubble telescope is fully operational again, BMW will help recreate 'Rocket League' in real life, and Tesla’s in-dash video games can be played even while driving..",2021-12-08T12:17:19Z,Engadget,The Morning After: The Hubble telescope wakes up from 'hibernation' - Engadget,https://www.engadget.com/the-morning-after-the-hubble-telescope-wakes-up-from-hibernation-121526960.html,https://s.yimg.com/os/creatr-uploaded-images/2021-12/faf2bb70-5773-11ec-bdf5-071d24c531ce
Stephen Luntz,science,"The asteroid 4660 Nereus will make its closest approach to Earth for decades this Saturday. At 3.9 million kilometers (2.4 million miles), the passage is not particularly near three months ago an ast… [+2941 chars]",usa,"The asteroid 4660 Nereus will make its closest approach to Earth for decades this Saturday. At 3.9 million kilometers (2.4 million miles), the passage is n",2021-12-08T11:28:00Z,IFLScience,'Potentially Hazardous” And Extremely Valuable Asteroid To Whizz By Earth This Weekend - IFLScience,https://www.iflscience.com/space/potentially-hazardous-and-extremely-valuable-asteroid-to-whizz-by-earth-this-weekend/,https://cdn.iflscience.com/images/845dee3b-86da-5094-851c-60d1f71d7eb9/default-1638958075-asteroid.jpg
Bild.de,sports,"Nächste Runde im Zoff um Schiri Zwayer!
Nach Dortmund-Boss Hans-Joachim Watzke (62) hat sich nun auch BVB-Sportdirektor Michael Zorc (59) zum Verhalten von Bundesliga-Schiri Felix Zwayer (40) geäuße… [+1815 chars]",deu,Nächste Runde im Zoff zwischen dem BVB und Schiedsrichter Felix Zwayer. Nach Klub-Boss Watzke legt jetzt auch Sportdirekt Zorc nach.,2021-12-09T09:32:56Z,Bild,BVB: „Durch und erledigt“ – Zorc legt gegen Schiri Zwayer nach! - BILD,https://www.bild.de/sport/fussball/fussball/bvb-durch-und-erledigt-zorc-legt-gegen-schiri-zwayer-nach-78490410.bild.html,https://bilder.bild.de/fotos/bvb-durch-und-erledigt--zorc-legt-gegen-schiri-zwayer-nach--b6d7dd4f8c32417ab008e2a8dafbdda5-78490404/Bild/3.bild.jpg
SPORT1,sports,"Der FC Barcelona hat eine historische Schmach erlitten.
Nach dem Spiel war Clément Lenglet zu sehen, wie er mit Bayern-Stürmer Robert Lewandowski lachte. Die Szene des Barca-Verteidigers, der in der… [+817 chars]",deu,Clément Lenglet lacht nach dem Barca-Aus mit Robert Lewandowski. Fans und Medien sind empört.,2021-12-09T09:15:23Z,SPORT1,Barca-Fans empört: Lenglet lacht mit Bayern-Star Lewandowski - SPORT1,https://www.sport1.de/news/fussball/champions-league/2021/12/barca-fans-emport-lenglet-lacht-mit-bayern-star-lewandowski,https://reshape.sport1.de/c/t/c07cd33b-2869-4d48-9666-e1e22e5e7146/1200x630
Katharina Wiedenmann,sports,"Bayern-Trainer Julian Nagelsmann (l.) mit Benfica-Coach Jorge Jesus
Fotocredit: Imago",deu,Benfica steht im Achtelfinale der Champions League. Trainer Jorge Jesus bedankte sich nach dem Spiel auch beim FC Bayern. Denn der half unfreiwillig mit.,2021-12-09T08:37:00Z,Eurosport.de,Benfica-Coach Jorge Jesus bedankt sich beim FC Bayern und Julian Nagelsmann für Schützenhilfe - Eurosport DE,https://www.eurosport.de/fussball/champions-league/2021-2022/benfica-dynamo-kiew-fc-bayern-fc-barcelona-achtelfinale-jorge-jesus-dankt-nagelsmann_sto8664614/story.shtml,https://i.eurosport.com/2021/12/09/3268584-66888948-2560-1440.jpg
Sebastian Fischer,sports,"""Er gewinnt vielleicht noch mehr an Bedeutung, wenn keine Zuschauer da sind"": Beim 3:0 der Bayern gegen Barça schießt der Nationalspieler sein 50. Champions-League-Tor - und belegt die Stärke der Mün… [+5166 chars]",deu,Champions League: Beim 3:0 der Münchner gegen Barça schießt der Nationalspieler sein 50. Königsklassen-Tor.,2021-12-09T08:15:30Z,Süddeutsche Zeitung,FC Bayern gegen Barcelona: Ein goldener Geist für Thomas Müller - Süddeutsche Zeitung - SZ.de,https://www.sueddeutsche.de/sport/thomas-mueller-bayern-barcelona-1.5483824,https://www.sueddeutsche.de/image/sz.1.5483825/1200x675?v=1639038717
,sports,"Eintracht-Trainer Oliver Glasner sieht große Fortschritte und will auch in Istanbul auf Sieg spielen, selbst wenn ein Remis freie Fahrt ins Achtelfinale bedeutet.
Frankfurt am Main - Dieser Tage hat… [+6180 chars]",deu,"Eintracht-Trainer Oliver Glasner sieht große Fortschritte und will auch in Istanbul auf Sieg spielen, selbst wenn ein Remis freie Fahrt ins Achtelfinale bedeutet.",2021-12-09T08:12:00Z,Www.fr.de,Eintracht Frankfurt: Das ist Glasners Plan für die Europa League - fr.de,https://www.fr.de/eintracht-frankfurt/eintracht-frankfurt-oliver-glasner-plan-europa-league-startelf-fenerbahce-istanbul-91166628.html,https://www.fr.de/bilder/2021/12/08/91166628/27660729-auf-ihn-wird-es-im-hexenkessel-ankommen-eintracht-torwart-kevin-trapp-der-im-hinspiel-einen-elfer-parierte-2Bi0bFUdNKef.jpg
dpa,sports,"Den englischen Topklub hat ein heftiger Corona-Ausbruch getroffen. Deshalb wollen die Londoner heute nicht in der Conference League antreten. Gegner Rennes hält von einer Absage allerdings nichts.
T… [+1606 chars]",deu,Tottenham hat ein heftiger Corona-Ausbruch getroffen. Rennes hält von den Plänen des englischen Teams nichts.,2021-12-09T07:49:47Z,t-online.de,Conference League: Corona-Ausbruch – Tottenham will nicht gegen Rennes antreten - t-online.de,https://www.t-online.de/sport/fussball/id_91291478/conference-league-corona-ausbruch-tottenham-will-nicht-gegen-rennes-antreten.html,https://bilder.t-online.de/b/91/29/15/08/id_91291508/tid_da/die-tottenham-hotspur-um-kapitaen-harry-kane-r-und-tanguay-ndombele-sind-von-einem-corona-ausbruch-im-verein-betroffen-.jpg
"Aus Abu Dhabi berichten: Silja Rulle, Michel Milewski und Tom Kollmar",sports,"Zwei sind einer zu viel!
In drei Tagen entscheidet sich der spannendste WM-Kampf seit Jahren: Lewis Hamilton (36) gegen Max Verstappen (24). Nur einer wird Weltmeister werden.
Nach dem Auffahr-Cras… [+1734 chars]",deu,Zwei sind einer zu viel! In drei Tagen entscheidet sich der spannendste WM-Kampf seit Jahren: Lewis Hamilton (36) gegen Max Verstappen (24).,2021-12-09T07:27:12Z,Bild,Formel 1: Hamilton vs. Verstappen: Mit diesem Crash begann der Hass - BILD,https://www.bild.de/sport/motorsport/motorsport/formel-1-hamilton-vs-verstappen-mit-diesem-crash-begann-der-hass-78489010.bild.html,https://bilder.bild.de/fotos/formel-1-hamilton-vs-verstappen-mit-diesem-crash-begann-der-hass-123107747261446996622d5586f08257-78489014/Bild/2.bild.jpg
Tim Ursinus,sports,Eine Vertragsverlängerung mit Dan-Axel Zagadou ist bei Borussia Dortmund wohl noch kein Thema. Moderater Sebastian Pufpaff hat nach seinem Prank Stadionverbot. News und Gerüchte zum BVB im Überblick.… [+3523 chars],deu,Eine Vertragsverlängerung mit Dan-Axel Zagadou ist bei Borussia Dortmund wohl noch kein Thema. Moderater Sebastian Pufpaff hat nach seinem Prank Stadionverbot. News und Gerüchte zum BVB im Überblick.,2021-12-09T06:35:00Z,SPOX,BVB - News und Gerüchte: Vertragsverlängerung mit Dan-Axel Zagadou wohl noch kein Thema - SPOX,https://www.spox.com/de/sport/fussball/bundesliga/2112/Artikel/bvb-borussia-dortmund-news-und-geruechte-zagadou-tv-total-prank.html,https://www.spox.com/de/sport/fussball/bundesliga/2112/Bilder/zagadou-1200.jpg
n-tv NACHRICHTEN,sports,"Shaquille O'Neal juckt es mächtig in den Fingern. Am Freitag kommen bei einer Auktion die elf Meisterringe von NBA-Legende Bill Russell unter den Hammer, und ""Shaq"" will zuschlagen. ""Wenn ich alle se… [+649 chars]",deu,Der Sport-Tag,2021-12-09T06:31:22Z,N-tv.de,"Der Sport-Tag am Donnerstag, 09. Dezember 2021 - n-tv.de - n-tv NACHRICHTEN",https://www.n-tv.de/sport/der_sport_tag/Der-Sport-Tag-am-Donnerstag-09-Dezember-2021-article22987103.html,https://bilder3.n-tv.de/img/incoming/crop22987794/954132958-cImg_16_9-w1200/267379210.jpg
n-tv NACHRICHTEN,sports,Die Ausgangslage für das Saisonfinale der Formel 1 könnte nicht spannender sein. Der WM-Führende Max Verstappen ist punktgleich mit dem Zweiten Lewis Hamilton. Gibt es den großen Knall beim Großen Pr… [+5459 chars],deu,Die Ausgangslage für das Saisonfinale der Formel 1 könnte nicht spannender sein. Der WM-Führende Max Verstappen ist punktgleich mit dem Zweiten Lewis Hamilton. Gibt es den großen Knall beim Großen Preis von Abu Dhabi? Die Rivalen im Vergleich.,2021-12-09T06:24:37Z,N-tv.de,WM-Showdown in der Formel 1: Was für Verstappen spricht - und was für Hamilton - n-tv NACHRICHTEN,https://www.n-tv.de/sport/formel1/Was-fuer-Verstappen-spricht-und-was-fuer-Hamilton-article22986549.html,https://bilder2.n-tv.de/img/incoming/crop22986577/9541327072-cImg_16_9-w1200/imago1008488784h.jpg
,sports,"Während der FC Bayern sich gestern Abend die perfekte Gruppenphase gesichert hat, musste sich der FC Barcelona vorzeitig aus der Champions League verabschieden. Hier sind die Pressestimmen zu dem ges… [+1329 chars]",deu,"Während der FC Bayern sich gestern Abend die perfekte Gruppenphase gesichert hat, musste sich der FC Barcelona vorzeitig aus der Champions League verabschieden. Hier sind die Pressestimmen zu dem gestrigen CL-Duell zwischen dem FCB und dem FCB. Deutschland ki…",2021-12-09T06:00:09Z,Fcbinside.de,"Die Pressestimmen zum Spiel gegen Barcelona: ""Bayern frisst Barça auf!"" - Aktuelle FC Bayern News - fcbinside.de",https://fcbinside.de/2021/12/09/📰-die-pressestimmen-zum-spiel-gegen-barcelona-bayern-frisst-barca-auf/,https://fcbinside.de/wp-content/uploads/2021/12/imago1008529996h.jpg
Florian Rebien,sports,,deu,"Am Montag hatte die Staatsanwaltschaft Hamburg Anklage gegen Bakery Jatta erhoben, weil sie der Meinung ist, dass es sich bei dem HSV-Profi eigentlich um den gut zwei Jahre älteren Bakary Daffeh handle. Jattas Anwalt kann den Vorgang nicht nachvollziehen und …",2021-12-09T05:46:00Z,Mopo.de,Vorwürfe gegen Jatta: HSV-Trainer Walter wird deutlich - Hamburger Morgenpost,https://www.mopo.de/?p=298973,https://cdn.mopo.de/uploads/sites/4/2021/06/imago1006846201h-scaled.jpg
"dpa, t-online",sports,"Vor dem Topspiel gegen den FC Bayern wollte sich eine falsche BVB-Elf Zutritt zum Signal-Iduna-Park verschaffen. Hinter der Aktion steckte ""TV Total""-Moderator Sebastian Pufpaff  der nun die Bilder d… [+2317 chars]",deu,"Vor dem Topspiel gegen den FC Bayern wollte sich eine falsche BVB-Elf Zutritt zum Signal-Iduna-Park verschaffen. Sebastian Pufpaff, 'TV Total'-Moderator, steckte dahinter.",2021-12-09T05:20:59Z,t-online.de,"Nach BVB-Eklat: ""TV Total""-Moderator Sebastian Pufpaff meldet sich zu Wort - t-online.de",https://www.t-online.de/region/dortmund/news/id_91290968/nach-bvb-eklat-tv-total-moderator-sebastian-pufpaff-meldet-sich-zu-wort.html,https://bilder.t-online.de/b/91/29/09/72/id_91290972/tid_da/fuer-seinen-neuesten-scoop-versuchte-tv-total-moderator-sebastian-pufpaff-seine-optische-aehnlichkeit-zu-bvb-trainer-marco-rose-zu-nutzen-.jpg
"Jannik Sorgatz, Hannah Gobrecht",sports,"9. Dezember 2021 um 07:04 Uhr
UpdateMönchengladbach Borussia Mönchengladbach hat sich von einem ihrer Physiotherapeuten getrennt. Grund soll ein gefälschter Impfausweis sein, die Polizei ermittelt n… [+3880 chars]",deu,"Borussia Mönchengladbach hat sich von einem ihrer Physiotherapeuten getrennt. Grund soll ein gefälschter Impfausweis sein, die Polizei ermittelt nun. Was der Fall indirekt mit Bremens Ex-Trainer Markus Anfang zu tun hat.",2021-12-09T05:04:00Z,RP ONLINE,Borussia Mönchengladbach - Impfpass-Fälschung? Ärger um Physiotherapeut - RP ONLINE,https://rp-online.de/sport/fussball/borussia/borussia-moenchengladbach-impfpass-faelschung-aerger-um-physiotherapeut_aid-64519855,https://rp-online.de/imgs/32/1/1/9/7/6/3/3/1/9/tok_04229244629b2fac7a7c56a16d6f9487/w1200_h630_x593_y352_imago0046296626h-3ab910444be8493e.jpg
Thomas Gaber,sports,"Jamal Musiala, Alphonso Davies und Thomas Müller (v.l.) vom FC Bayern München
Fotocredit: Getty Images",deu,"Der FC Bayern hat sich als Gruppensieger fürs Achtelfinale der Champions League qualifiziert, könnte dort aber auf PSG treffen. Lostöpfe & Infos zur Auslosung.",2021-12-08T23:18:00Z,Eurosport.de,"Auslosung Achtelfinale: FC Bayern droht PSG, Chelsea oder Atlético in K.o.-Runde - so sehen die Lostöpfe aus - Eurosport DE",https://www.eurosport.de/fussball/champions-league/2021-2022/auslosung-achtelfinale-lostoepfe-fc-bayern-drohen-starke-gegner-psg-chelsea-atletico_sto8662817/story.shtml,https://i.eurosport.com/2021/12/08/3268537-66888008-2560-1440.jpg
DER SPIEGEL,sports,IOC-Präsident Thomas Bach hat das Schweigen des Internationalen Olympischen Komitees zur viel kritisierten Menschenrechtssituation in China erneut verteidigt. »Wenn ich keine politischen Kommentare a… [+2159 chars],deu,Das Internationale Olympische Komitee lässt die Menschenrechtslage in China unkommentiert. IOC-Chef Thomas Bach will dem Ausrichter der Winterspiele 2022 gegenüber neutral bleiben – und warnt vor einer »Politisierung«.,2021-12-08T22:23:44Z,Spiegel Online,Bach verteidigt China-Kurs des IOC: Politische Haltung? »Kann das Ende der Olympischen Spiele bedeuten« - DER SPIEGEL,https://www.spiegel.de/sport/olympia/thomas-bach-verteidigt-china-kurs-des-ioc-politische-haltung-kann-das-ende-der-olympischen-spiele-bedeuten-a-7aff668e-c68f-47d1-88fb-8020e5eb8f39,https://cdn.prod.www.spiegel.de/images/cb32c9f5-ccf2-4b39-9dfa-c674274e66db_w1280_r1.77_fpx66.56_fpy50.jpg
SID,sports,,deu,Red Bull Salzburg bezwingt den FC Sevilla und erreicht erstmals das Achtelfinale der Champions League. Ralf Rangnick spielt mit Manchester United nur remis.,2021-12-08T22:05:17Z,SPORT1,"Champions League: Salzburg im Achtelfinale, Rangnick mit ManUnited remis - SPORT1",https://www.sport1.de/news/fussball/champions-league/2021/12/champions-league-salzburg-im-achtelfinale-rangnick-mit-manunited-remis,https://reshape.sport1.de/c/t/7f7b8702-e90f-4bce-925a-6e1ba6493150/1200x630
,sports,,deu,"UEFA Champions League, 6. Spieltag: Die Zusammenfassung des Spiels Manchester United gegen Young Boys Bern in der Saison 21/22.",2021-12-08T22:00:00Z,Www.zdf.de,Manchester United-Young Boys Bern 1:1 | Highlights - sportstudio - ZDFsport,https://www.zdf.de/sport/uefa-champions-league/manchester-united-mun-yb-young-boys-bern-highlights-zusammenfassung-100.html,https://www.zdf.de/assets/manchester-united-young-boys-100~1280x720?cb=1639001597830
,sports,,deu,"UEFA Champions League, 6. Spieltag: Die Zusammenfassung des Spiels Borussia Dortmund gegen Besiktas in der Saison 21/22.",2021-12-08T22:00:00Z,Www.zdf.de,Borussia Dortmund gegen Besiktas 5:0 | Highlights - sportstudio - ZDFsport,https://www.zdf.de/sport/uefa-champions-league/borussia-dortmund-bvb-bjk-besiktas-highlights-zusammenfassung-100.html,https://www.zdf.de/assets/borussia-dortmund-besiktas-istanbul-100~1280x720?cb=1638987668228
,sports,,deu,"UEFA Champions League, 6. Spieltag: Die Zusammenfassung des Spiels RB Leipzig gegen Manchester City in der Saison 21/22.",2021-12-08T22:00:00Z,Www.zdf.de,RB Leipzig gegen Manchester City 2:1 | Highlights - sportstudio - ZDFsport,https://www.zdf.de/sport/uefa-champions-league/rb-leipzig-rbl-mci-manchester-city-highlights-zusammenfassung-100.html,https://www.zdf.de/assets/rb-leipzig-manchester-city-100~1280x720?cb=1638987546619
"Jean-Michel Décugis, Ronan  Folgoas, Caroline Piquet",sports,"Il est visé par une enquête préliminaire ouverte le 20 novembre pour agression sexuelle. Pierre Ménès a été convoqué puis placé ce jeudi en garde à vue, selon nos informations, confirmées depuis par … [+1508 chars]",fra,INFO LE PARISIEN. L’ancien journaliste de Canal + est mis en cause par une hôtesse du Parc des Princes pour des gestes déplacés possiblement commis lors du match PSG-Nantes le 20 novembre.,2021-12-09T10:17:00Z,Le Parisien,"Visé par une enquête pour «agression sexuelle», Pierre Ménès en garde à vue - Le Parisien",https://www.leparisien.fr/faits-divers/vise-par-une-enquete-pour-agression-sexuelle-pierre-menes-place-en-garde-a-vue-09-12-2021-3M2PETFM5ZCXHC6LPJGVK5CPYE.php,https://www.leparisien.fr/resizer/wYokwNenvRUbOgcxYWK9sC35cho=/1200x675/cloudfront-eu-central-1.images.arcpublishing.com/leparisien/G4R7IAJBW5BZTBJQMKTCWJOOEE.jpg
Vincent Bregevin,sports,"La joie des Lillois après le but de Burak Yilmaz face à Wolfsbourg, le 8 décembre 2021 en Ligue des champions
Crédit: Getty Images",fra,Lille a brillamment décroché son billet pour les 8es de finale et terminé en tête de son groupe en s'imposant à Wolfsbourg (1-3) mercredi.,2021-12-09T09:51:00Z,Eurosport.fr,"L'antisèche de Wolfsbourg - Lille (1-3) : Les Dogues, comme des champions ! - Eurosport FR",https://www.eurosport.fr/football/ligue-des-champions/2021-2022/l-antiseche-de-wolfsbourg-lille-1-3-les-dogues-comme-des-champions_sto8664544/story.shtml,https://i.eurosport.com/2021/12/09/3268543-66888128-2560-1440.jpg
,sports,L'ancienne joueuse de tennis professionnelle succède ainsi à Guy Forget à la tête du Gand Chelem parisien.Les Internationaux de France tiennent désormais leur nouvelle directrice. L'ancienne joueuse … [+1381 chars],fra,L'ancienne joueuse de tennis professionnelle succède ainsi à Guy Forget à la tête du Gand Chelem parisien.,2021-12-09T09:48:21Z,Francetvinfo.fr,Tennis : Amélie Mauresmo succède à Guy Forget à la direction de Roland-Garros - franceinfo,https://www.francetvinfo.fr/sports/tennis/masters-1000/tennis-amelie-mauresmo-succede-a-guy-forget-et-prend-la-direction-de-roland-garros_4872557.html,https://www.francetvinfo.fr/pictures/JldQ0OhQFktznmGxw2Nej1r3UgM/1500x843/2021/12/07/phpDeJQAe.jpg
Julien Laloye,sports,"Le football français n’en finit pas de prendre de la hauteur. Après le show « Actor Studio » du directeur de la communication marseillais Jacques Cardoze à faire passer De Niro pour un amateur, c’est… [+1210 chars]",fra,"Comme l’OM, l’OL a dénoncé la décision de la commission de discipline de lui retirer un point",2021-12-09T09:40:45Z,20 Minutes,"Incidents OL-OM : Une décision « incompréhensible » pour Lyon, qui réfléchit aussi à faire appel - 20 Minutes",https://www.20minutes.fr/sport/3193331-20211209-incidents-ol-om-decision-incomprehensible-lyon-reflechit-aussi-faire-appel,https://img.20mn.fr/Mucx3p1rQVOMPyOB_l_9iSk/648x360_jean-michel-aulas-lors-presentation-jerome-boateng-aout-2020.jpg
Glenn Ceillier,sports,"Burak Yilmaz, buteur lors du match opposant Wolfsbourg à Lille, le 8 décembre 2021 en Ligue des champions
Crédit: Getty Images",fra,"Si le match entre l'Atalanta et Villarreal va clôturer la phase de poules ce jeudi, le plateau des 8es de la C1 est presque entièrement connu.",2021-12-09T09:37:00Z,Eurosport.fr,LIGUE DES CHAMPIONS - Les qualifiés pour les 8es de finale de la C1 et les adversaires possibles du PSG et du LOSC - Eurosport FR,https://www.eurosport.fr/football/ligue-des-champions/2021-2022/ligue-des-champions-les-qualifies-pour-les-8es-de-finale-de-la-c1-et-les-adversaires-possibles-du-ps_sto8664465/story.shtml,https://i.eurosport.com/2021/12/08/3268519-66887648-2560-1440.jpg
,sports,,fra,,2021-12-09T09:24:28Z,Google News,"Tottenham – Stade Rennais. Match annulé, une date de report proposée par les Anglais - Ouest-France",https://news.google.com/__i/rss/rd/articles/CBMiogFodHRwczovL3d3dy5vdWVzdC1mcmFuY2UuZnIvc3BvcnQvZm9vdGJhbGwvc3RhZGUtcmVubmFpcy90b3R0ZW5oYW0tc3RhZGUtcmVubmFpcy1sLXVlZmEtY29uZmlybWUtbC1hbm51bGF0aW9uLWRlLWxhLXJlbmNvbnRyZS00Mjk4YWU2MC01OGNmLTExZWMtYTAxMC1kY2MxOGRhMjJjMDXSAQA?oc=5,
Stéphane Tan,sports,"La suite après cette publicité
Le Barça plus bas que terre
Une débâcle historique. Face au Bayern Munich, le FC Barcelone a une fois de plus été humilié (3-0). Mais cette-fois, les conséquences son… [+2099 chars]",fra,"L'Espagne a honte du Barça, qualification historique pour le LOSC, Tottenham effrayé par la flambée de cas de Covid, retrouvez dans votre revue de presse Foot Mercato les dernières informations de la presse sportive européenne.",2021-12-09T09:24:24Z,Foot Mercato,"L'Espagne enterre le Barça de Xavi, la presse célèbre la qualification historique du LOSC - Foot Mercato",https://www.footmercato.net/a554099506370618050-lespagne-enterre-le-barca-de-xavi-la-presse-celebre-la-qualification-historique-du-losc,https://assets-fr.imgfoot.com/media/cache/1200x675/photo-rvp-61b1b9bc30a6a.jpg
T.M.,sports,"Publié le 9 décembre 2021 à 10h10 par T.M. Si Pascal Dupraz apparait comme lun des favoris pour occuper le banc de lASSE, laffaire est encore loin dêtre réglée. 
Aujourdhui, à lASSE, la question est… [+920 chars]",fra,"Si Pascal Dupraz apparait comme l’un des favoris pour occuper le banc de l’ASSE, l’affaire est encore loin d’être réglée.",2021-12-09T09:10:00Z,Le 10 Sport,Mercato - ASSE : Une complication à prévoir avec Pascal Dupraz ? - Le 10 Sport,https://le10sport.com/football/mercato/mercato-asse-une-complication-a-prevoir-avec-pascal-dupraz-579009,https://le10static.com/img/master/0000/0019/198917.jpeg
Julien Pedebos,sports,"Zapping Onze Mondial TOP 10 : Les plus beaux maillots de la Ligue 1 2021/2022
Après avoir obtenu une victoire convaincante (4-1) face à Bruges cette semaine en Ligue des champions, le PSG doit confi… [+1240 chars]",fra,"Tandis que les nouvelles sont bonnes concernent Sergio Ramos, cela s'accompagne d'un autre souci ennuyeux du côté de l'infirmerie du PSG.",2021-12-09T09:02:00Z,Onze Mondial,PSG : un nouveau coup dur gâche le retour annoncé de Sergio Ramos - Onze Mondial,https://www.onzemondial.com/ligue-1/psg-un-nouveau-coup-dur-gache-le-retour-annonce-de-sergio-ramos-727767,https://static.onzemondial.com/photo_article/727767/285713/1200-L-psg-un-nouveau-coup-dur-gche-le-retour-annonc-de-sergio-ramos.jpg
Aury Bouzar,sports,"Le ministre de l'Éducation a affirmé ce jeudi 9 décembre que la France ne suivrait pas les États-Unis et d'autres pays dans le boycott diplomatique des JO d'hiver de Pékin. 
 Les États-Unis ont fait… [+783 chars]",fra,Le ministre de l'Éducation a affirmé ce jeudi 9 décembre que la France ne suivrait pas les États-Unis et d'autres pays dans le boycott diplomatique des JO d'hiver de Pékin.,2021-12-09T08:57:00Z,L'Indépendant,Jean-Michel Blanquer affirme que la France ne boycottera pas les JO d'hiver de Pékin - L'Indépendant,https://www.lindependant.fr/2021/12/09/jean-michel-blanquer-affirme-que-la-france-ne-boycottera-pas-les-jo-dhiver-de-pekin-9981237.php,https://images.lindependant.fr/api/v1/images/view/61b1c4df8fe56f0d3f361495/large/image.jpg?v=1
,sports,"Auteur d'un doublé face à Bruges (4-1) mardi en Ligue des Champions, l'attaquant du Paris Saint-Germain Lionel Messi (34 ans, 9 matchs et 1 but en L1 cette saison), recruté l'été dernier au terme de … [+825 chars]",fra,"Auteur d'un doublé face à Bruges (4-1) mardi en Ligue des Champions, l'attaquant du Paris Saint-Germain Lionel Messi (34...",2021-12-09T08:57:00Z,Maxifoot.fr,"PSG : Messi, une adaptation compliquée... - Barça",https://news.maxifoot.fr/psg/messi-une-adaptation-compliquee-foot-359438.htm,https://news.maxifoot.fr/amp/359438.jpg
,sports,"Michael Masi, directeur de course de la Formule 1, prévient que des sanctions pourraient être prises en cas daccident volontaire, dimanche lors du dernier Grand Prix de la saison à Abou Dhabi où le t… [+2731 chars]",fra,"Michael Masi, directeur de course de la Formule 1, prévient que des sanctions pourraient être prises en cas d’accident volontaire, dimanche lors du dernier Grand Prix de la saison à Abou Dhabi où le titre mondial se jouera entre Max Verstappen et Lewis Hamilt…",2021-12-09T08:50:55Z,BFMTV,F1: le directeur de course prévient Verstappen en cas de crash - RMC Sport,https://rmcsport.bfmtv.com/auto-moto/f1/f1-le-directeur-de-course-previent-verstappen-en-cas-de-crash_AV-202112090161.html,https://images.bfmtv.com/NJwdmTc1GoVjSjcPgyYXwwDKZj8=/0x106:2048x1258/images/Max-Verstappen-1184760.jpg
Mehdi Lunay,sports,"Kylian Mbappé est sur une autre planète en ce moment. Sa prestation contre Bruges, deux buts et une passe décisive, a encore ébloui les observateurs. Johan Micoud fait partie d'entre eux et, pour lui… [+2268 chars]",fra,"Kylian Mbappé est sur une autre planète en ce moment. Sa prestation contre Bruges, deux buts et une passe décisive, a encore ébloui les observateurs. Johan Micoud fait partie d'entre eux et, pour lui, ce Mbappé devient de plus en plus imprévisible pour…",2021-12-09T08:40:30Z,Foot01.com,Transfert Mbappé - PSG : Kylian Mbappé devient ingérable - Foot 01 - Foot01,https://www.foot01.com/transfert-mbappe-mercato/psg-kylian-mbappe-devient-ingerable-392825,https://www.foot01.com/img/images/1200x/2021/Dec/08/mbappe-est-ingerable-micoud-en-est-fan-icon_dib-071221-10-164-329829.jpg
Maxime Battistella,sports,"Thomas Müller et Kingsley Coman face à Barcelone en 2021
Crédit: Getty Images",fra,LIGUE DES CHAMPIONS - Buteur mercredi contre le FC Barcelone lors de la large victoire du Bayern Munich (3-0) qui a éliminé les Catalans dès la phase de poules,2021-12-09T08:15:00Z,Eurosport.fr,"Ligue des champions - Müller : ""Le Barça ne peut pas faire face à l'intensité"" - Eurosport FR",https://www.eurosport.fr/football/ligue-des-champions/2021-2022/ligue-des-champions-muller-le-barca-ne-peut-pas-faire-face-a-l-intensite_sto8664700/story.shtml,https://i.eurosport.com/2021/12/09/3268573-66888728-2560-1440.jpg
