author,category,content,country,description,publishedAt,source,title,url,urlToImage
Sven Bauduin,technology,"OnePlus hat damit begonnen, OxygenOS 12 auf Basis von ColorOS und Android 12 an Nutzer der Smartphones OnePlus 9 und OnePlus 9 Pro (Test) auszurollen. Damit einher gehen unter anderem auch ein verbes… [+3561 chars]",deu,"OnePlus hat damit begonnen, OxygenOS 12 auf Basis von Android 12 für das OnePlus 9 und OnePlus 9 Pro auszurollen.",2021-12-07T12:27:00Z,ComputerBase,Android 12: OnePlus 9 and 9 Pro get the update to OxygenOS 12 - ComputerBase,https://www.computerbase.de/2021-12/android-12-oneplus-9-und-9-pro-erhalten-das-update-auf-oxygenos-12/,https://pics.computerbase.de/1/0/1/5/8/0-2485f9b7c747e3e0/article-1280x720.00676239.jpg
"t-online, Steve Haak",technology,"Der Vorgesetzte eines New Yorker Unternehmens hat 900 seiner Mitarbeiter in einem Online-Meeting entlassen. Ein Angestellter filmte die Konferenz.
""Wenn Sie bei diesem Anruf dabei sind, gehören Sie … [+1642 chars]",deu,Der Vorgesetzte eines New Yorker Unternehmens hat 900 seiner Mitarbeiter in einem Online-Meeting entlassen. Ein Angestellter filmte die Konferenz.,2021-12-07T11:56:00Z,t-online.de,900 employees fired via zoom call - t-online.de,https://www.t-online.de/digital/internet/id_100003748/900-mitarbeiter-per-zoom-call-gefeuert.html,https://bilder.t-online.de/b/91/27/95/54/id_91279554/tid_da/ein-junger-mann-der-ein-headset-traegt-nimmt-an-einer-videokonferenz-teil-.jpg
"dpa, Alexander Roth-Grigori",technology,"Die Luca-App erhält eine neue Funktion: In Zukunft können Nutzer freiwillig den eigenen Impfstatus mit dem zuständigen Gesundheitsamt teilen.
Die Luca-App zur Kontaktnachverfolgung erhält eine neue … [+2627 chars]",deu,Die Luca-App erhält eine neue Funktion: In Zukunft können Nutzer freiwillig den eigenen Impfstatus mit dem zuständigen Gesundheitsamt teilen.,2021-12-07T11:48:00Z,t-online.de,Corona app: Luca gets new chat function - t-online.de,https://www.t-online.de/digital/handy/id_100003746/corona-app-luca-erhaelt-neue-chat-funktion.html,https://bilder.t-online.de/b/91/27/88/32/id_91278832/tid_da/die-nutzerinnen-und-nutzer-der-luca-app-koennen-kuenftig-freiwillig-ihren-eigenen-impfstatus-mit-ihrem-zustaendigen-gesundheitsamt-teilen-.jpg
André Westphal,technology,Laut den Kollegen von 9to5Google habe Fossil mittlerweile eine ursprünglich geplante Diesel-Smartwatch der Gen 6 mit Wear OS zu den Akten gelegt. Da das Wearable bisher aber noch gar nicht angekündig… [+1765 chars],deu,Laut den Kollegen von 9to5Google habe Fossil mittlerweile eine ursprünglich geplante Diesel-Smartwatch der Gen 6 mit Wear OS zu den Akten ...,2021-12-07T11:30:00Z,Caschys Blog,Fossil said to have cancelled unannounced Diesel smartwatch with Wear OS - Caschy's Blog,https://stadt-bremerhaven.de/fossil-soll-unangekuendigte-diesel-smartwtach-mit-wear-os-gestrichen-haben/,https://stadt-bremerhaven.de/wp-content/uploads/2021/06/Fossil-Logo.jpg
DER SPIEGEL,technology,"Damit habe man die Sicherheit seiner Familie »überall im Blick«, heißt es in der Beschreibung der Smartphone-App Life360 in Googles Play Store. Mehr als 50 Millionen Mal ist die Software auf Android-… [+3050 chars]",deu,"Eigentlich soll die App Life360 Familienmitgliedern helfen, einander zu finden. Die dabei produzierten Daten werden dann aber weiterverkauft, um das Gratisangebot zu finanzieren.",2021-12-07T11:22:00Z,Spiegel Online,Life360: Tracking app sells location data of millions of users to data traders - DER SPIEGEL,https://www.spiegel.de/netzwelt/apps/tracking-app-verkauft-ortsangaben-von-millionen-nutzern-an-datenhaendler-a-e2441408-d245-4d8e-a542-7a22868c3d24,https://cdn.prod.www.spiegel.de/images/f4fda6dc-64a6-4dc7-b4e1-99ceee1804d8_w1280_r1.77_fpx68.51_fpy48.98.jpg
Jennifer Li,technology,"Im Dezember 2009 tauchten zum ersten Mal Ideen auf, WLAN alias Wi-Fi auch im lizenzfreien Bereich unterhalb von 1 GHz zu betreiben. Gegenüber dem Betrieb im etablierten 2,4-GHz-Band versprach diese I… [+3840 chars]",deu,Nach 12 Jahren Standardentwicklung hat die Wi-Fi Alliance ganze sechs Geräte fürs IoT-WLAN unter 1 GHz zertifiziert.,2021-12-07T10:37:00Z,heise online,Wi-Fi HaLow for the Internet of Things: Morse code from the (WLAN) crypt - heise online,https://www.heise.de/hintergrund/Wi-Fi-HaLow-fuers-Internet-der-Dinge-Morsezeichen-aus-der-WLAN-Gruft-6287807.html,https://heise.cloudimg.io/bound/1200x1200/q85.png-lossy-85.webp-lossy-85.foil1/_www-heise-de_/imgs/18/3/2/2/8/0/7/2/SmartHome-8b3d8faf0749f8ed.JPG
Sponsored Post,technology,"Mit dem jüngsten Update unterstützt DeFiChain nun dezentrale Kredite und Vermögenswerte. Das DeFi-Protokoll will damit dem traditionellen Finanzmarkt heftige Konkurrenz machen.
Die DeFiChain ist vor… [+4696 chars]",deu,Mit dem jüngsten Update unterstützt DeFiChain nun dezentrale Kredite und Vermögenswerte. Das DeFi-Protokoll will damit dem traditionellen Finanzmarkt heftige Konkurrenz machen.,2021-12-07T10:36:54Z,Btc-echo.de,DeFiChain's hard fork makes decentralised assets lucrative for millions - BTC-ECHO,https://www.btc-echo.de/news/defichains-hard-fork-macht-dezentrale-vermoegenswerte-fuer-millionen-menschen-lukrativ-129751/,https://www.btc-echo.de/wp-content/uploads/2021/12/DeFiChain.png
Christoph Hoffmann,technology,"Christoph Hoffmann
Gaming-Headsets, Wireless-Gaming-Mäuse sowie Tastaturen, Mikrofone und Smart Glasses für Gamer gibt es diese Woche bei Amazon zu Top-Preisen. Bei den Gaming-Keyboards sparen Sie b… [+1353 chars]",deu,"Gaming-Headsets, -Mäuse, -Tastaturen oder Smart Glasses von Razor gibt es bei Amazon diese Woche zu Top-Preisen.",2021-12-07T09:15:00Z,PC-WELT,Save up to 50% on gaming accessories during Razer week at Amazon - PC-WELT,https://www.pcwelt.de/news/In-der-Razer-Woche-bei-Amazon-bis-zu-50-auf-Gaming-Zubehoer-sparen-11148954.html,https://bilder.pcwelt.de/4323574_1000x500_r.jpg
Volker Rißka,technology,"Intel hat heute das Ende der Core i-10000H eingeläutet, die als letzte Skylake-Auskopplung Comet Lake-H mit bis zu 8 Kernen im Notebook zugegen waren. Da nun bereits seit einem knappen halben Jahr ac… [+1262 chars]",deu,"Intel hat heute das Ende der Core i-10000H eingeläutet, die als letzte Skylake-Auskopplung mit bis zu 8 Kernen im Notebook zugegen waren.",2021-12-07T09:11:00Z,ComputerBase,Intel processors: First Comet Lake-H aka Core i-10000H retire - ComputerBase,https://www.computerbase.de/2021-12/intel-prozessoren-erste-comet-lake-h-alias-core-i-10000h-gehen-in-rente/,https://pics.computerbase.de/1/0/1/5/8/1-79a13ede43318635/article-1280x720.aedea2cc.jpg
caschy,technology,"Im Jahr 2021 des Herrn:
– nur USB 2.0 (Aufpreis für 3.0 in der Herstellung: 10 cent? 50 cent? 1 EUR?)
– WLAN nur 2,4 GHz (Aufpreis für 5 GHz in der Herstellung: 1 EUR? 3 EUR? 5 EUR?)
– nur 1 LAN P… [+523 chars]",deu,"AVM hat die neue FRITZ!Box 7510 vorgestellt, eine Box, die sich an Nutzer richtet, die einen DSL-Anschuss haben und ein Einsteigermodell ...",2021-12-07T09:06:00Z,Caschys Blog,AVM FRITZ!Box 7510 presented: What's inside - Caschys Blog,https://stadt-bremerhaven.de/avm-fritzbox-7510-vorgestellt-das-steckt-drin/,https://stadt-bremerhaven.de/wp-content/uploads/2021/12/AVM_FRITZBox_7510_Wi-Fi_6_.jpg
Sven Bauduin,technology,Die Tabellenkalkulation Microsoft Excel aus der Office-Suite Microsoft Office und dessen Abo-Version Microsoft 365 erhält als Web-App neue Funktionen und kann jetzt unter anderem mit größeren Dateien… [+4753 chars],deu,Die Tabellenkalkulation Microsoft Excel erhält als Web-App neue Funktionen und kann jetzt unter anderem mit größeren Dateien umgehen.,2021-12-07T08:51:00Z,ComputerBase,Microsoft Excel: Spreadsheet gets new functions as a web app - ComputerBase,https://www.computerbase.de/2021-12/microsoft-excel-tabellenkalkulation-erhaelt-als-web-app-neue-funktionen/,https://pics.computerbase.de/1/0/1/5/7/7-efb23565cb133476/article-1280x720.6e265fa4.jpg
Kaan Gürayer,technology,Zieht Samsung jetzt die Konsequenzen aus den miserablen Verkaufszahlen des Galaxy S21? Der südkoreanische Hersteller stellt sich intern neu auf und hat einen radikalen Neuanfang angekündigt. Ein erfa… [+1953 chars],deu,Zieht Samsung jetzt die Konsequenzen aus den miserablen Verkaufszahlen des Galaxy S21? Der südkoreanische Hersteller stellt sich intern neu auf und hat einen radikalen Neuanfang angekündigt. Ein erfahrener Samsung-Manager soll die strauchelnde Smartphone-Abte…,2021-12-07T08:47:36Z,Giga,A drumbeat at Samsung: smartphone manufacturer plans radical new start - Giga,https://www.giga.de/news/paukenschlag-bei-samsung-smartphone-hersteller-plant-radikalen-neuanfang/,https://crops.giga.de/65/2b/ab/408fafc7a0aadc281366c7c409_YyAyODIweDE0NzMrOTArMTA4AnJlIDEyMDAgNjI3AzZiNGZjMGQ4Njcw.jpg
,technology,,deu,,2021-12-07T08:47:15Z,Google News,Successful MMO Myth of Empires has disappeared from Steam without a trace - Developer speaks out - My-MMO,https://news.google.com/__i/rss/rd/articles/CBMiO2h0dHBzOi8vbWVpbi1tbW8uZGUvbXl0aC1vZi1lbXBpcmVzLXZvbi1zdGVhbS12ZXJzY2h3dW5kZW4v0gE_aHR0cHM6Ly9tZWluLW1tby5kZS9teXRoLW9mLWVtcGlyZXMtdm9uLXN0ZWFtLXZlcnNjaHd1bmRlbi9hbXAv?oc=5,
,technology,"Pour le gestionnaire du réseau électrique français, l'emplacement des futures centrales devra tenir compte du changement climatique.
L'emplacement des futurs réacteurs nucléaires en France devrait t… [+2492 chars]",fra,"Pour le gestionnaire du réseau électrique français, l'emplacement des futures centrales devra tenir compte du changement climatique.",2021-12-07T15:43:21Z,BFMTV,New nuclear power plants: RTE pleads for locations near the sea - BFMTV,https://www.bfmtv.com/economie/entreprises/energie/nouvelles-centrales-nucleaires-rte-plaide-pour-des-emplacements-pres-de-la-mer_AD-202112070347.html,https://images.bfmtv.com/nPRU-JVGVcUH30UPsavNbX-JE9w=/0x40:768x472/768x0/images/Les-cheminees-de-la-centrale-nucleaire-de-Cattenom-le-2-juin-2020-1157871.jpg
,technology,"Univers Freebox vous propose de découvrir l’application Notifications for Android TV. Elle permet, comme son nom l’indique, de recevoir les notifications depuis son smartphone, mais pas seulement.
S… [+3148 chars]",fra,"Univers Freebox vous propose de découvrir l’application Notifications for Android TV. Elle permet, comme son nom l’indique, de recevoir les notifications depuis son smartphone, mais pas seulement. Si vous êtes toujours à l’affut de vos notifications, voici un…",2021-12-07T15:26:57Z,Univers Freebox,"Freebox Pop and mini 4K subscribers, you can receive notifications from your smartphone on your phone. - Freebox universe",https://www.universfreebox.com/article/510241/abonnes-freebox-pop-et-mini-4k-vous-pouvez-recevoir-les-notifications-de-votre-smartphone-sur-votre-televiseur,https://www.universfreebox.com/wp-content/uploads/2021/04/freebox-pop-mini-4K.jpg
Fanny Dufour,technology,"Après avoir été victime d'un vol lui ayant fait perdre 119 millions de dollars, la plateforme BadgerDAO essaie d'amadouer son attaquant pour retrouver son argent. 
Elle lui promet entre autres une r… [+2353 chars]",fra,"Après avoir été victime d'un vol lui ayant fait perdre 119 millions de dollars, la plateforme BadgerDAO essaie d'amadouer son attaquant pour retrouver son argent.",2021-12-07T15:05:00Z,Clubic,"BadgerDAO, victim of $119m crypto heist, begs thief to return money - Clubic",https://www.clubic.com/antivirus-securite-informatique/virus-hacker-piratage/piratage-informatique/actualite-397527-badgerdao-victime-du-braquage-de-crypto-a-119-millions-supplie-ses-voleurs-de-rendre-l-argent.html,https://pic.clubic.com/v1/images/1852532/raw?width=900&height=600&fit=max&hash=504feaf35626a29f721a182a54c2c62f2ab8b2e4
Lionel Steinmann,technology,"L'assembleur attitré des iPhones d'Apple, le leader de la course vers la voiture autonome et un spécialiste allemand du haut de gamme automobile : pour mener à bien sa stratégie logiciel pour les dix… [+2685 chars]",fra,Stellantis va nouer des partenariats avec ces trois entreprises pour se doter de semi-conducteurs plus « flexibles » et progresser vers la conduite autonome.,2021-12-07T15:03:44Z,Les Echos,"Foxconn, Waymo, BMW... Carlos Tavares and Stellantis's high-end casting - Les Echos",https://www.lesechos.fr/industrie-services/automobile/foxconn-waymo-bmw-le-casting-haut-de-gamme-de-carlos-tavares-et-stellantis-1370493,https://media.lesechos.com/api/v1/images/view/61af7829d286c278d636b346/1280x720/070491553570-web-tete.jpg
,technology,[AVIS D'EXPERT] Les banques se sont davantage consacrées ces dernières années à l'expérience clients qu'aux services proposés. Et leurs clients se tournent vers des solutions fournies par des fintech… [+4475 chars],fra,"[AVIS D'EXPERT] Les banques se sont davantage consacrées ces dernières années à l'expérience clients qu'aux services proposés. Et leurs clients se tournent vers des solutions fournies par des fintechs. Décryptage avec notre expert Guillaume Almeras, fondateur…",2021-12-07T15:03:17Z,BFMTV,Banks are beginning to realise that their customers are less and less captive - BFMTV,https://www.bfmtv.com/economie/experts/guillaume-almeras/les-banques-commencent-a-realiser-que-leurs-clients-sont-de-moins-en-moins-captifs_AN-202112070333.html,https://images.bfmtv.com/FlOkZJnIGdjglQi6ucVpeswvF-M=/0x66:1280x786/1280x0/images/-477358.jpg
Romain Ribout,technology,"Avant Xiaomi, Honor était sans aucun doute le champion du rapport qualité-prix dans l'hexagone. La marque chinoise tente aujourd'hui de redorer son blason d'antan avec des smartphones de nouveau comp… [+5205 chars]",fra,"Avant Xiaomi, Honor était sans aucun doute le champion du rapport qualité-prix dans l'hexagone. La marque chinoise tente aujourd'hui de redorer son blason d'antan avec des smartphones de nouveau compatibles avec les services de Google, et son Honor 50 en fait…",2021-12-07T14:55:56Z,Frandroid,Honor becomes a value-for-money champion again with this promotion on the Honor 50 - Frandroid,https://www.frandroid.com/bons-plans/1149491_le-honor-50-avec-les-services-google-est-moins-cher-quau-black-friday,https://images.frandroid.com/wp-content/uploads/2021/11/honor-50-module-photo-scaled.jpg
Marco Mosca,technology,"Les Numériques fait un pas supplémentaire vers la réparabilité. Après avoir intégré les offres de seconde main dans nos tableaux, et l'indice de réparabilité dans nos tests, voici une série vidéo pou… [+3590 chars]",fra,"Les Numériques fait un pas supplémentaire vers la réparabilité. Après avoir intégré les offres de seconde main dans nos tableaux, et l'indice de réparabilité dans nos tests, voici une série vidéo pour bien réparer vos appareils tech.",2021-12-07T14:36:00Z,Les Numériques,Les Numériques tackles tech device repair in video tutorial - Les Numériques,https://www.lesnumeriques.com/vie-du-net/les-numeriques-s-attaque-a-la-reparation-des-appareils-tech-en-tuto-video-n172485.html,https://dyw7ncnq1en5l.cloudfront.net/optim/news/17/172485/d17b2dfa-les-numeriques-s-attaque-a-la-reparation-des-appareils-tech-en-tuto-video__1200_630__0-144-3840-2160_wtmk.jpeg
Nathan Le Gohlisse,technology,"Comme le rappelle TechPowerUp, le 4700S disposait d'un seul emplacement PCIe x4 Gen 2.0, ce qui le limitait à prendre seulement en charge des cartes graphiques
 entrée de gamme. Cela réduisait aussi… [+260 chars]",fra,"L'AMD 4700S Desktop Kit avait fait parler de lui pour sa proximité technologique avec la PlayStation 5
. Eh bien, il sera remplacé prochainement. AMD prévoit en effet l'arrivée d'un 4800S dès le début d'année prochaine.",2021-12-07T14:30:00Z,Clubic,"AMD 4800S Desktop Kit: the successor to the ""PlayStation 5 kit"" will arrive in 2022 - Clubic",https://www.clubic.com/pro/entreprise/amd/actualite-397509-amd-4800s-desktop-kit-le-successeur-du-kit-playstation-5-arrivera-bien-en-2022.html,https://pic.clubic.com/v1/images/1949565/raw?width=900&height=600&fit=max&hash=44b447a8633c987c340cae0fb9ecd3a112da908d
Matt_Clank,technology,"Événement rare en ce moment : on vous a trouvé une carte graphique qui vaut le coup ! En effet, cette dernière est proposée à un prix (pas trop) excessif, et elle vous permettra en plus de profiter d… [+2955 chars]",fra,"Événement rare en ce moment : on vous a trouvé une carte graphique qui vaut le coup ! En effet, cette dernière est proposée à un prix (pas trop) excessif, et elle vous permettra en plus de profiter des derniers jeux du moment ! Disponible pour un peu moins de…",2021-12-07T14:05:01Z,jeuxvideo.com,Finally a graphics card at an (almost) decent price - jeuxvideo.com,https://www.jeuxvideo.com/news/1503708/enfin-une-carte-graphique-a-un-prix-presque-decent.htm,https://image.jeuxvideo.com/medias-md/163888/1638883647-3113-card.png
Mon Livret,technology,"Selon Whalestat, une baleine crypto vient d’ajouter 99 milliards de Shiba Inu, d’une valeur de 3 799 999 $, à son portefeuille. Le Shiba Inu rebondit après avoir touché son plus bas niveau à 0,000032… [+1273 chars]",fra,"Selon Whalestat, une baleine crypto vient d'ajouter 99 milliards de Shiba Inu, d'une valeur de 3 799 999 $, à",2021-12-07T13:48:56Z,Mon-livret.fr,SHIB: A whale buys 99 billion Shiba Inu! - My Booklet,https://www.mon-livret.fr/shib-une-baleine-achete-99-milliards-de-shiba-inu.html,https://www.mon-livret.fr/wp-content/uploads/2021/11/shiba-inu-millionaire.jpeg
Noëllie Mautaint,technology,"Aussi farfelu que cela puisse paraître, le marché de limmobilier du metaverse, le réseau despaces virtuels interconnectés, est déjà en train de flamber.
Rien que la semaine dernière, plus de 100 mil… [+1246 chars]",fra,"Aussi farfelu que cela puisse paraître, le marché de l’immobilier du metaverse
, le réseau d’espaces virtuels interconnectés, est déjà en train de flamber.",2021-12-07T13:45:00Z,Clubic,Can you afford a flat in the metaverse? Over $100 million already spent on virtual real estate - Clubic,https://www.clubic.com/technologies-d-avenir/actualite-397500-arriverez-vous-a-vous-payer-un-appart-dans-le-metaverse-plus-de-100-millions-de-dollars-deja-depenses-en-immobilier-virtuel.html,https://pic.clubic.com/v1/images/1940175/raw?width=900&height=600&fit=max&hash=68c588b4f14e57eae06bb69526da159e3aa1827b
Guillaume Sonnet,technology,"Pour une fois, SFR n'a pas attendu de s'aligner sur ses concurrents pour proposer son offre Fibre à bas prix. L'opérateur rouge profite de la saison de Noël pour sacrifier le prix de sa SFR Box 7 qui… [+3312 chars]",fra,"Pour une fois, SFR n'a pas attendu de s'aligner sur ses concurrents pour proposer son offre Fibre à bas prix. L'opérateur rouge profite de la saison de Noël pour sacrifier le prix de sa SFR Box 7 qui se retrouve aujourd'hui à seulement 10 euros par mois.",2021-12-07T11:30:14Z,Frandroid,SFR currently offers the cheapest fibre: only €10/month - Frandroid,https://www.frandroid.com/bons-plans/1148903_sfr-propose-actuellement-la-fibre-la-moins-chere-seulement-10-e-mois,https://images.frandroid.com/wp-content/uploads/2021/12/fibre-sfr-10-euros.jpg
Elsa Rouden,technology,"Quels sont les meilleurs jeux de 2021 selon les équipes de l'App Store et du Play Store Google ? A l'occasion du passage à l'année 2022, les spécialistes d'iOS et Android ont désigné leurs lauréats, … [+2744 chars]",fra,"Des jeux de stratégie à ceux d’arcade, découvrez le classement des meilleures apps jouables de l’année, selon l’App Store et le Play Store Google.",2021-12-07T11:28:59Z,Femina.fr,Awards: here is the official ranking of the best video games of 2021 on Android and iOS - Version Femina,https://www.femina.fr/article/palmares-voici-le-classement-officiel-des-meilleurs-jeux-video-de-2021-disponibles-sur-android-et-ios,"https://resize.prod.femina.ladmedia.fr/rblr/1401,978/img/var/2021-12/meilleurs-jeux-android-iphone-2021.jpg"
Louis Neveu,technology,Microsoft a pris le contrôle de nombreux sites Web utilisés par un groupe de hackers soutenu par le gouvernement chinois. Ils permettaient de mener des attaques pour cyberespionner des organisations … [+3354 chars],fra,Microsoft a pris le contrôle de nombreux sites Web utilisés par un groupe de hackers soutenu par le gouvernement chinois. Ils permettaient de mener des attaques pour cyberespionner des...,2021-12-07T10:41:21Z,Futura,Microsoft scores a point in its fight against Chinese-backed hackers - Futura-Sciences,https://www.futura-sciences.com/tech/actualites/cybersecurite-microsoft-marque-point-lutte-pirates-soutenus-chine-95403/,https://cdn.futura-sciences.com/buildsv6/images/wide1920/6/5/3/65333a14ff_50184036_hacker-action.jpg
Matt_Clank,technology,"Rue du Commerce propose en ce moment une très belle promotion sur lécran PC incurvé de chez Gigabyte. Ce dernier affiche une résolution en 1440p avec une dalle particulièrement réactive, idéal pour l… [+2559 chars]",fra,"Rue du Commerce propose en ce moment une très belle promotion sur l’écran PC incurvé de chez Gigabyte. Ce dernier affiche une résolution en 1440p avec une dalle particulièrement réactive, idéal pour le gaming ! En plus il est proposé avec une belle réduction …",2021-12-07T10:38:26Z,jeuxvideo.com,The 32-inch gamer PC monitor 1440p ultra-responsive under 350€! - jeuxvideo.com,https://www.jeuxvideo.com/news/1503614/l-ecran-pc-gamer-32-pouces-gamer-1440p-ultra-reactif-passe-sous-les-350.htm,https://image.jeuxvideo.com/medias-md/163887/1638873486-6149-card.png
,technology,,fra,,2021-12-07T10:36:03Z,Google News,"""We're being let down! 1,900 jobs threatened at Orange service provider - Ouest-France",https://news.google.com/__i/rss/rd/articles/CBMigwFodHRwczovL3d3dy5vdWVzdC1mcmFuY2UuZnIvaGlnaC10ZWNoL29yYW5nZS8xOTAwLWVtcGxvaXMtbWVuYWNlcy1jaGV6LXVuLXByZXN0YXRhaXJlLWQtb3JhbmdlLWMwZDAzZWNjLTU3NDYtMTFlYy04MDkwLTI5NjJjM2Y5NjhlZtIBgwFodHRwczovL2FtcC5vdWVzdC1mcmFuY2UuZnIvaGlnaC10ZWNoL29yYW5nZS8xOTAwLWVtcGxvaXMtbWVuYWNlcy1jaGV6LXVuLXByZXN0YXRhaXJlLWQtb3JhbmdlLWMwZDAzZWNjLTU3NDYtMTFlYy04MDkwLTI5NjJjM2Y5NjhlZg?oc=5,
,technology,"À l'approche des fêtes de fin d'année, la recherche de cadeaux s'intensifie, et certains acheteurs sont prêts à tout pour recevoir leurs produits avant le 25 décembre. Il faut cependant se méfier de … [+5183 chars]",fra,Ce livre de science-fiction vous était vendu sur Amazon grâce à un mensonge honteux.,2021-12-07T10:22:19Z,Hitek.fr,Amazon: this SF book was sold to you thanks to a shameful lie - Hitek.fr,https://hitek.fr/actualite/amazon-arnaque-livres-vieux-mensonges_32017,https://static.hitek.fr/img/actualite/ill_m/1486018031/livresmensonge.jpg
Geoffroy Husson,technology,"Une vidéo permet de découvrir un prototype d'objectif rétractable développé par Oppo pour ses futurs smartphones. 
Lappareil photo rétractable dOppo // Source : Oppo
Oppo est bien connu pour ses in… [+3285 chars]",fra,Une vidéo permet de découvrir un prototype d'objectif rétractable développé par Oppo pour ses futurs smartphones.,2021-12-07T10:20:07Z,Frandroid,Oppo develops retractable lens for upcoming smartphones - Frandroid,https://www.frandroid.com/marques/oppo/1148895_oppo-developpe-un-objectif-retractable-pour-ses-prochains-smartphones,https://images.frandroid.com/wp-content/uploads/2021/12/oppo-retractable.jpg
Grégoire Huvelin,technology,"Selon des nouveaux rendus signés OnLeaks, la future Samsung Galaxy Tab S8 Ultra pourrait bel et bien accueillir deux capteurs avant dans son encoche.
Source : OnLeaks avec 91Mobiles
Après plusieurs… [+2797 chars]",fra,"Selon des nouveaux rendus signés OnLeaks, la future Samsung Galaxy Tab S8 Ultra pourrait bel et bien accueillir deux capteurs avant dans son encoche.",2021-12-07T10:16:25Z,Frandroid,Samsung Galaxy Tab S8 Ultra: its notch would not be there for nothing unlike the MacBook Pro 2021 - Frandroid,https://www.frandroid.com/marques/samsung/1148959_samsung-galaxy-tab-s8-ultra-son-encoche-ne-serait-pas-la-pour-rien-contrairement-aux-macbook-pro-2021,https://images.frandroid.com/wp-content/uploads/2021/10/samsung-galaxy-tab-s8-ultra-4-scaled.jpg
Charles Sannat,technology,"C’est un article du site Investing duquel on peut partir pour livrer une analyse qui peut aller un peu plus loin que l’écume des choses dont on n’a que trop l’habitude.
« Les cryptomonnaies, menées … [+5486 chars]",fra,"C’est un article du site Investing duquel on peut partir pour livrer une analyse qui peut aller un peu plus loin que l’écume des choses dont on n’a que trop l’habitude. « Les cryptomonnaies, menées par le Bitcoin, ont connu un nouveau crash ce weekend, le BTC…",2021-12-07T10:14:49Z,Insolentiae.com,Bitcoin crash. What if the queen of cryptocurrencies behaved like gold? - Insolentiae,https://insolentiae.com/?p=501647,https://insolentiae.com/wp-content/uploads/bitcoin-crash.jpg
Barbara Krasnoff,technology,"Things we love but dont want to admit to
If you buy something from a Verge link, Vox Media may earn a commission. See our ethics statement.
Photo: Ember Technologies
We all have stuff that weve bo… [+10521 chars]",usa,"We asked the staff of The Verge what some of their guilty pleasures are, and the braver among us volunteered some answers.",2021-12-07T15:42:25Z,The Verge,The Verge’s favorite guilty pleasures - The Verge,https://www.theverge.com/22820219/guilty-pleasures-ice-halo-dyson-sims,https://cdn.vox-cdn.com/thumbor/drSm8YEs54SwvUJ4mEN9ugfTt_E=/0x286:1200x914/fit-in/1200x630/cdn.vox-cdn.com/uploads/chorus_asset/file/23069913/ember_cup_with_phone.jpeg
,technology,,usa,"Serious Sam 4 is available now on PS5, Xbox Series X|S, and Game Pass. Watch the action-packed Serious Sam 4 trailer for another look at the prequel to the S...",2021-12-07T15:30:03Z,YouTube,Serious Sam 4 - Official PS5 and Xbox Series X|S Launch Trailer - IGN,https://www.youtube.com/watch?v=BkamisPwkj0,https://i.ytimg.com/vi/BkamisPwkj0/maxresdefault.jpg
